d_provincia_us;d_canton_us;d_edificio_us;d_edificio_recepcion;d_usuario_recepcion;d_especializacion_us;d_cedula_fiscal;d_nombre_fiscal;d_fiscalia;d_ndd;d_fecha_us;d_fecha_incidente;d_anio_us;d_anio_incidente;d_delito_circunstancial;d_tipo_flagrante;d_etapa_actual;d_fecha_ini_ip;d_fecha_fin_ip;d_tiempo;d_tipo_delito;d_estado_procesal;d_fecha_estado_procesal;d_estado_ndd;d_origen_denuncia;d_numero_informe;d_agrupa_estados;d_delito_secuencia;d_coip_cpp;d_seccion_coip;d_articulo;d_articulo_circunstancial;d_tiempo_inv;d_tiempo_invjv;d_tiempo_ins;d_tiempo_insjv;d_delito;d_modalidad;d_ultima_accion;d_fecha_ultima_accion;d_fecha_ps;d_anio_ps;d_mes_ps;d_hora_ps;d_hora_incidente;d_grupo_horainc;d_hora_us;d_coordenadas_incidente;d_provincia_incidente;d_canton_incidente;d_direccion_incidente;d_parroquia_incidente;d_urb_rural_incidente;d_barrio_incidente;d_delito_desagregacion;d_lugar_desagregacion;d_modalidad_desagregacion;d_tipo_arma;d_lugar_incidente;d_dia_us;d_mes_us;d_dia_incidente;d_mes_incidente;d_vehiculo;d_bien;d_fuero;d_fecha_archivo_solicitado;d_archivo_solicitado_consulta;d_impulsos;d_diligencias;d_medidas_proteccion_numero;d_medidas_proteccion_descripcion;d_involucrado_aprehendido;d_involucrado_sospechoso;d_involucrado_procesado;d_involucrado_detenido;d_involucrado_imputado;d_involucrado_victimario;d_involucrado_victima;d_involucrado_desaparecido;d_involucrado_fallecido;d_denunciante;d_denunciante_fge;d_imprescriptible;d_reserva_identidad;d_ndd_grupo;d_robo_cat6_model;d_robo_cat6_umsiaf;d_robo_cat6_comision;d_robo_cat6_umcomision;d_robo_cat11_model;d_robo_cat11_umsiaf;d_estado_ml;d_provincia_incidente_cod;d_canton_incidente_cod;d_parroquia_incidente_cod;d_desplegar;f_provincia_us;f_canton_us;f_edificio_us;f_edificio_recepcion;f_usuario_recepcion;f_especializacion_us;f_cedula_fiscal;f_nombre_fiscal;f_fiscalia;f_ndd;f_fecha_us;f_fecha_incidente;f_anio_us;f_anio_incidente;f_delito_circunstancial;f_tipo_flagrante;f_etapa_actual;f_fecha_ini_ip;f_fecha_fin_ip;f_tiempo;f_tipo_delito;f_estado_procesal;f_fecha_estado_procesal;f_estado_ndd;f_origen_denuncia;f_numero_informe;f_agrupa_estados;f_delito_secuencia;f_coip_cpp;f_seccion_coip;f_articulo;f_articulo_circunstancial;f_tiempo_inv;f_tiempo_invjv;f_tiempo_ins;f_tiempo_insjv;f_delito;f_modalidad;f_ultima_accion;f_fecha_ultima_accion;f_fecha_ps;f_anio_ps;f_mes_ps;f_hora_ps;f_hora_incidente;f_grupo_horainc;f_hora_us;f_coordenadas_incidente;f_provincia_incidente;f_canton_incidente;f_direccion_incidente;f_parroquia_incidente;f_urb_rural_incidente;f_barrio_incidente;f_delito_desagregacion;f_lugar_desagregacion;f_modalidad_desagregacion;f_tipo_arma;f_lugar_incidente;f_dia_us;f_mes_us;f_dia_incidente;f_mes_incidente;f_vehiculo;f_bien;f_fuero;f_fecha_archivo_solicitado;f_archivo_solicitado_consulta;f_impulsos;f_diligencias;f_medidas_proteccion_numero;f_medidas_proteccion_descripcion;f_involucrado_aprehendido;f_involucrado_sospechoso;f_involucrado_procesado;f_involucrado_detenido;f_involucrado_imputado;f_involucrado_victimario;f_involucrado_victima;f_involucrado_desaparecido;f_involucrado_fallecido;f_denunciante;f_denunciante_fge;f_imprescriptible;f_reserva_identidad;f_ndd_grupo;f_robo_cat6_model;f_robo_cat6_umsiaf;f_robo_cat6_comision;f_robo_cat6_umcomision;f_robo_cat11_model;f_robo_cat11_umsiaf;f_estado_ml;f_provincia_incidente_cod;f_canton_incidente_cod;f_parroquia_incidente_cod;f_desplegar;d_fecha_inicio_if;d_fecha_cierre_if;d_fecha_prepa_juicio_inicio;d_numero_juicio;d_fecha_sentencia_condenatoria;d_fecha_procedimiento_directo;d_fecha_recepcion_ndd;d_recibe_recepcion_ndd;d_entrega_recepcion_ndd;f_fecha_inicio_if;f_fecha_cierre_if;f_fecha_prepa_juicio_inicio;f_numero_juicio;f_fecha_sentencia_condenatoria;f_fecha_procedimiento_directo;f_fecha_recepcion_ndd;f_recibe_recepcion_ndd;f_entrega_recepcion_ndd;d_fecha_archivo_aceptado;f_fecha_archivo_aceptado;d_fecha_sentencia_absolutoria;f_fecha_sentencia_absolutoria;d_fecha_procedimiento_abreviado;f_fecha_procedimiento_abreviado;d_fecha_dictamen_mixto;f_fecha_dictamen_mixto;d_fecha_sobreseimiento;f_fecha_sobreseimiento;d_fecha_extincion_accion_penal;d_tipo_extincion_accion_penal;f_fecha_extincion_accion_penal;f_tipo_extincion_accion_penal;d_nna_grupo_infractor;d_nna_edad_victima;d_nna_relacion_victima;d_nna_victimas;d_nna_victima_sexo;f_nna_grupo_infractor;f_nna_edad_victima;f_nna_relacion_victima;f_nna_victimas;f_nna_victima_sexo;d_fecha_medidas_proteccion;f_fecha_medidas_proteccion;d_fecha_suspension_condicional_pena;f_fecha_suspension_condicional_pena;d_unicandd;f_unicandd;d_fecha_dictamen_acusatorio;d_fecha_llamamiento_juicio;f_fecha_dictamen_acusatorio;f_fecha_llamamiento_juicio;d_fecha_concilacion;d_fecha_repuesta_concilacion_remision;d_concilacion_tipo;f_fecha_concilacion;f_fecha_repuesta_concilacion_remision;f_concilacion_tipo;d_fecha_dictamen_abstentivo;f_fecha_dictamen_abstentivo;d_consulta_superior_resultado;d_tipo_consulta_superior;f_consulta_superior_resultado;f_tipo_consulta_superior;d_fecha_vinculacion;f_fecha_vinculacion;d_fecha_reformulacion_cargos;d_reformulacion_cargos_resultado;f_fecha_reformulacion_cargos;f_reformulacion_cargos_resultado;d_fecha_principio_oportunidad_solicitado;d_fecha_principio_oportunidad_aceptado;d_principio_oportunidad_resultado;f_fecha_principio_oportunidad_solicitado;f_fecha_principio_oportunidad_aceptado;f_principio_oportunidad_resultado;d_fecha_extincion_pena;d_tipo_extincion_pena;f_fecha_extincion_pena;f_tipo_extincion_pena
PICHINCHA;QUITO;NORTE  UVC - CALDERON;CASA DE LA JUSTICIA;CUAICAL ENRIQUEZ LIGIA TAMARA;FISCALIA DE VIOLENCIA DE GENERO;1001526142;NUÑEZ HERRERIA JUAN CARLOS ;FISCALIA DE VIOLENCIA DE GENERO 1;1,70102E+14;22/09/2023;22/09/2023;2023;2023;VIOLENCIA PSICOLÓGICA CONTRA LA MUJER O MIEMBROS DEL NÚCLEO FAMILIAR;NO FLAGRANTE;INVESTIGACION PREVIA;27/09/2023;26/09/2024;-186;CONSUMADO;ARCHIVO ACEPTADO;19/02/2025 0:00;ARCHIVADA POR ACEPTACION DE SOLICITUD;OFICIO DE DELEGACIÓN;2338-512-2023-1-jmpdmpam-m;CON ESTADO;3733;COIP;II - Delitos Contra los Derechos de Libertad;157;S.D.;1 ANIO;4 MESES;90 DIAS;45 DIAS;VIOLENCIA PSICOLÓGICA CONTRA LA MUJER O MIEMBROS DEL NÚCLEO FAMILIAR;Origen Desconocido;SOLICITUD DE ARCHIVO;18/02/2025;22/09/2023;2023;9;14:27:09;14:27:09;TARDE;14:27:09;-0.08575,-78.41574;PICHINCHA;QUITO;CALDERON (CARAPUNGO) (P);CALDERON (CARAPUNGO);RURAL;24 DE JUNIO;NO_APLICA;NO APLICA;NO APLICA;NO APLICA;Oficina;VIERNES;9;VIERNES;9; -   -   - ; - USD.;FUERO ORDINARIO;19/02/2025;RECHAZADO;1;4;0;[];0;1;0;0;0;1;1;0;0;1;SI;NO;NO;PASIVO;S.D.;S.D.;S.D.;S.D.;S.D.;S.D.;S.D.;17;1701;170155;EXTERNO;PICHINCHA;QUITO;NORTE  UVC - CALDERON;CASA DE LA JUSTICIA;CUAICAL ENRIQUEZ LIGIA TAMARA;FISCALIA DE VIOLENCIA DE GENERO;1001526142;NUÑEZ HERRERIA JUAN CARLOS;FISCALIA DE VIOLENCIA DE GENERO 1;1,70102E+14;1,69536E+12;1,69536E+12;2023;2023;VIOLENCIA PSICOLÓGICA CONTRA LA MUJER O MIEMBROS DEL NÚCLEO FAMILIAR;NO FLAGRANTE;INVESTIGACION PREVIA;1,69579E+12;1,72733E+12;-186;CONSUMADO;ARCHIVO ACEPTADO;1,73994E+12;ARCHIVADA POR ACEPTACION DE SOLICITUD;OFICIO DE DELEGACIÓN;2338-512-2023-1-jmpdmpam-m;CON ESTADO;3733;COIP;II - Delitos Contra los Derechos de Libertad;157;S.D.;1 ANIO;4 MESES;90 DIAS;45 DIAS;VIOLENCIA PSICOLÓGICA CONTRA LA MUJER O MIEMBROS DEL NÚCLEO FAMILIAR;Origen Desconocido;SOLICITUD DE ARCHIVO;1,73985E+12;1,69536E+12;2023;9;14:27:09;14:27:09;TARDE;14:27:09;-0.08575,-78.41574;PICHINCHA;QUITO;CALDERON (CARAPUNGO) (P);CALDERON (CARAPUNGO);RURAL;24 DE JUNIO;NO_APLICA;NO APLICA;NO APLICA;NO APLICA;Oficina;VIERNES;9;VIERNES;9;-   -   -;#¿NOMBRE?;FUERO ORDINARIO;19/02/2025;RECHAZADO;1;4;0;[];0;1;0;0;0;1;1;0;0;1;SI;NO;NO;PASIVO;S.D.;S.D.;S.D.;S.D.;S.D.;S.D.;S.D.;17;1701;170155;EXTERNO;S.D.;S.D.;S.D.;S.D.;S.D.;S.D.;S.D.;S.D.;S.D.;S.D.;S.D.;S.D.;S.D.;S.D.;S.D.;S.D.;S.D.;S.D.;S.D.;S.D.;S.D.;S.D.;S.D.;S.D.;S.D.;S.D.;S.D.;S.D.;S.D.;S.D.;S.D.;S.D.;S.D.;S.D.;S.D.;S.D.;S.D.;S.D.;S.D.;S.D.;S.D.;S.D.;S.D.;S.D.;S.D.;S.D.;S.D.;S.D.;S.D.;S.D.;S.D.;S.D.;S.D.;S.D.;S.D.;S.D.;S.D.;S.D.;S.D.;S.D.;S.D.;S.D.;S.D.;S.D.;S.D.;S.D.;S.D.;S.D.;S.D.;S.D.;S.D.;S.D.;S.D.;S.D.;S.D.;S.D.;S.D.;S.D.;S.D.;S.D.
PICHINCHA;QUITO;NORTE - AMAZONAS;NORTE - AMAZONAS;BAEZ SOXO FAUSTO WILMO;FISCALIA DE PATRIMONIO CIUDADANO;601476609;BAYAS SANTILLAN MARIA ELENA ;FISCALIA DE PATRIMONIO CIUDADANO 5;1,70102E+14;23/08/2019;10/10/2018;2019;2018;ESTAFA;NO FLAGRANTE;INVESTIGACION PREVIA;02/09/2019;01/09/2021;-1307;CONSUMADO;ARCHIVO ACEPTADO;17/01/2022 0:00;ARCHIVADA POR ACEPTACION DE SOLICITUD;DENUNCIA FORMAL - ESCRITA;SN;CON ESTADO;3275;COIP;II - Delitos Contra los Derechos de Libertad;186;S.D.;2 ANIO;8 MESES;90 DIAS;45 DIAS;ESTAFA;Origen Desconocido;SOLICITUD DE ARCHIVO;02/10/2020;23/08/2019;2019;8;13:32:09;10:00:00;MAÑANA;13:32:09;-0.167487,-78.481934;PICHINCHA;QUITO;GENOVESA Y AV FLOREANA;JIPIJAPA;URBANO;JIPIJAPA;NO_APLICA;NO APLICA;NO APLICA;NO APLICA;Oficina;VIERNES;8;MIERCOLES;10; -   -   - ; - USD.;FUERO ORDINARIO;02/10/2020;SOLICITADO;3;4;0;[];0;3;0;0;0;3;0;0;0;1;NO;NO;NO;PASIVO;S.D.;S.D.;S.D.;S.D.;S.D.;S.D.;S.D.;17;1701;170114;EXTERNO;PICHINCHA;QUITO;NORTE - AMAZONAS;NORTE - AMAZONAS;BAEZ SOXO FAUSTO WILMO;FISCALIA DE PATRIMONIO CIUDADANO;601476609;BAYAS SANTILLAN MARIA ELENA;FISCALIA DE PATRIMONIO CIUDADANO 5;1,70102E+14;1,56654E+12;1,53915E+12;2019;2018;ESTAFA;NO FLAGRANTE;INVESTIGACION PREVIA;1,5674E+12;1,63047E+12;-1307;CONSUMADO;ARCHIVO ACEPTADO;1,6424E+12;ARCHIVADA POR ACEPTACION DE SOLICITUD;DENUNCIA FORMAL - ESCRITA;SN;CON ESTADO;3275;COIP;II - Delitos Contra los Derechos de Libertad;186;S.D.;2 ANIO;8 MESES;90 DIAS;45 DIAS;ESTAFA;Origen Desconocido;SOLICITUD DE ARCHIVO;1,60161E+12;1,56654E+12;2019;8;13:32:09;10:00:00;MAÑANA;13:32:09;-0.167487,-78.481934;PICHINCHA;QUITO;GENOVESA Y AV FLOREANA;JIPIJAPA;URBANO;JIPIJAPA;NO_APLICA;NO APLICA;NO APLICA;NO APLICA;Oficina;VIERNES;8;MIERCOLES;10;-   -   -;#¿NOMBRE?;FUERO ORDINARIO;02/10/2020;SOLICITADO;3;4;0;[];0;3;0;0;0;3;0;0;0;1;NO;NO;NO;PASIVO;S.D.;S.D.;S.D.;S.D.;S.D.;S.D.;S.D.;17;1701;170114;EXTERNO;S.D.;S.D.;S.D.;S.D.;S.D.;S.D.;S.D.;S.D.;S.D.;S.D.;S.D.;S.D.;S.D.;S.D.;S.D.;S.D.;S.D.;S.D.;S.D.;S.D.;S.D.;S.D.;S.D.;S.D.;S.D.;S.D.;S.D.;S.D.;S.D.;S.D.;S.D.;S.D.;S.D.;S.D.;S.D.;S.D.;S.D.;S.D.;S.D.;S.D.;S.D.;S.D.;S.D.;S.D.;S.D.;S.D.;S.D.;S.D.;S.D.;S.D.;S.D.;S.D.;S.D.;S.D.;S.D.;S.D.;S.D.;S.D.;S.D.;S.D.;S.D.;S.D.;S.D.;S.D.;S.D.;S.D.;S.D.;S.D.;S.D.;S.D.;S.D.;S.D.;S.D.;S.D.;S.D.;S.D.;S.D.;S.D.;S.D.;S.D.
SUCUMBIOS;LAGO AGRIO ( NUEVA LOJA );UNICA - NUEVA LOJA;UNICA - NUEVA LOJA;QUINTUÑA TAMAY IVON JISSELA;FISCALIA DE PERSONAS Y GARANTIAS;1712600020;ALENCASTRO CAMPAÑA JUAN JOSE ;FISCALIA DE PERSONAS Y GARANTIAS 1;2,10102E+14;22/05/2024;18/04/2024;2024;2024;ABORTO NO CONSENTIDO;NO FLAGRANTE;INVESTIGACION PREVIA;27/05/2024;27/05/2026;422;CONSUMADO;INVESTIGACION PREVIA;27/05/2024 0:00;ACTIVA;DENUNCIA FORMAL - ORAL;SN;CON ESTADO;4028;COIP;II - Delitos Contra los Derechos de Libertad;148;S.D.;2 ANIO;8 MESES;90 DIAS;45 DIAS;ABORTO NO CONSENTIDO;Origen Desconocido;AGREGAR DOCUMENTOS (ESCRITOS, PERICIAS) ;27/06/2024;22/05/2024;2024;5;13:22:18;10:30:00;MAÑANA;13:22:18;-76.96866,-76.96866;SUCUMBIOS;LAGO AGRIO ( NUEVA LOJA );"SANTA CECILIA ; KM 13 Y MEDIO DE LA VÍA QUITO A LA ALTURA DEL CONTROL";SANTA CECILIA;RURAL;SANTA CECILIA;NO_APLICA;NO APLICA;NO APLICA;NO APLICA;Parque;MIERCOLES;5;JUEVES;4; -   -   - ; - USD.;FUERO ORDINARIO;S.D.;S.D.;2;10;0;[];0;2;0;0;0;2;1;0;0;1;NO;NO;NO;ACTIVO;S.D.;S.D.;S.D.;S.D.;S.D.;S.D.;S.D.;21;2101;210158;EXTERNO;SUCUMBIOS;LAGO AGRIO ( NUEVA LOJA );UNICA - NUEVA LOJA;UNICA - NUEVA LOJA;QUINTUÑA TAMAY IVON JISSELA;FISCALIA DE PERSONAS Y GARANTIAS;1712600020;ALENCASTRO CAMPAÑA JUAN JOSE;FISCALIA DE PERSONAS Y GARANTIAS 1;2,10102E+14;1,71635E+12;1,71342E+12;2024;2024;ABORTO NO CONSENTIDO;NO FLAGRANTE;INVESTIGACION PREVIA;1,71679E+12;1,77986E+12;422;CONSUMADO;INVESTIGACION PREVIA;1,71679E+12;ACTIVA;DENUNCIA FORMAL - ORAL;SN;CON ESTADO;4028;COIP;II - Delitos Contra los Derechos de Libertad;148;S.D.;2 ANIO;8 MESES;90 DIAS;45 DIAS;ABORTO NO CONSENTIDO;Origen Desconocido;AGREGAR DOCUMENTOS (ESCRITOS, PERICIAS);1,71946E+12;1,71635E+12;2024;5;13:22:18;10:30:00;MAÑANA;13:22:18;-76.96866,-76.96866;SUCUMBIOS;LAGO AGRIO ( NUEVA LOJA );"SANTA CECILIA ; KM 13 Y MEDIO DE LA VÍA QUITO A LA ALTURA DEL CONTROL";SANTA CECILIA;RURAL;SANTA CECILIA;NO_APLICA;NO APLICA;NO APLICA;NO APLICA;Parque;MIERCOLES;5;JUEVES;4;-   -   -;#¿NOMBRE?;FUERO ORDINARIO;S.D.;S.D.;2;10;0;[];0;2;0;0;0;2;1;0;0;1;NO;NO;NO;ACTIVO;S.D.;S.D.;S.D.;S.D.;S.D.;S.D.;S.D.;21;2101;210158;EXTERNO;S.D.;S.D.;S.D.;S.D.;S.D.;S.D.;S.D.;S.D.;S.D.;S.D.;S.D.;S.D.;S.D.;S.D.;S.D.;S.D.;S.D.;S.D.;S.D.;S.D.;S.D.;S.D.;S.D.;S.D.;S.D.;S.D.;S.D.;S.D.;S.D.;S.D.;S.D.;S.D.;S.D.;S.D.;S.D.;S.D.;S.D.;S.D.;S.D.;S.D.;S.D.;S.D.;S.D.;S.D.;S.D.;S.D.;S.D.;S.D.;S.D.;S.D.;S.D.;S.D.;S.D.;S.D.;S.D.;S.D.;S.D.;S.D.;S.D.;S.D.;S.D.;S.D.;S.D.;S.D.;S.D.;S.D.;S.D.;S.D.;S.D.;S.D.;S.D.;S.D.;S.D.;S.D.;S.D.;S.D.;S.D.;S.D.;S.D.;S.D.
PICHINCHA;QUITO;NORTE - SENPLADES;NORTE - 9 DE OCTUBRE;ERAZO SALAZAR EDUARDO ENRIQUE;ATENCION AL PUBLICO TRANSITO;1103683213;BRAVO GALLARDO PATRICIA DEL PILAR ;ATENCION AL PUBLICO TRANSITO 1;1,70102E+14;18/12/2017;16/12/2017;2017;2017;ACCIDENTE DE TRANSITO CON SOLO LESIONES INDETERMINADOS.;NO FLAGRANTE;SIN ACCIONES;S.D.;S.D.;NO APLICA;CONSUMADO;SIN ESTADO;S.D.;ACTIVA;PARTE POLICIAL - TRANSITO - NO FLAGRANTE;2260;SIN ESTADO;2420;CONSTANCIAS;S.D.;S.D.;S.D.;30 DIAS;S.D.;45 DIAS;S.D.;ACCIDENTE DE TRANSITO CON SOLO LESIONES INDETERMINADOS.;Origen Desconocido;REGISTRO DE NDD;18/12/2017;18/12/2017;2017;12;19:16:05;17:10:00;TARDE;19:16:05;-0.10397,-78.50627;PICHINCHA;QUITO;"EL CONDADO  PARROQUIA EL CONDADO ; CALLE MIGUEL POZO Y RUMIÑAHUI";EL CONDADO;URBANO;EL CONDADO;NO_APLICA;NO APLICA;NO APLICA;NO APLICA;Parque;LUNES;12;SABADO;12;AUTOMOTOR  -  SE DESC  -  SE DESCONOCE  -   S.D. ; - USD.;FUERO ORDINARIO;S.D.;S.D.;0;0;0;[];0;1;0;0;0;1;1;0;0;1;SI;NO;NO;ACTIVO;S.D.;S.D.;S.D.;S.D.;S.D.;S.D.;S.D.;17;1701;170110;EXTERNO;PICHINCHA;QUITO;NORTE - SENPLADES;NORTE - 9 DE OCTUBRE;ERAZO SALAZAR EDUARDO ENRIQUE;ATENCION AL PUBLICO TRANSITO;1103683213;BRAVO GALLARDO PATRICIA DEL PILAR;ATENCION AL PUBLICO TRANSITO 1;1,70102E+14;1,51357E+12;1,5134E+12;2017;2017;ACCIDENTE DE TRANSITO CON SOLO LESIONES INDETERMINADOS.;NO FLAGRANTE;SIN ACCIONES;S.D.;S.D.;NO APLICA;CONSUMADO;SIN ESTADO;S.D.;ACTIVA;PARTE POLICIAL - TRANSITO - NO FLAGRANTE;2260;SIN ESTADO;2420;CONSTANCIAS;S.D.;S.D.;S.D.;30 DIAS;S.D.;45 DIAS;S.D.;ACCIDENTE DE TRANSITO CON SOLO LESIONES INDETERMINADOS.;Origen Desconocido;REGISTRO DE NDD;1,51357E+12;1,51357E+12;2017;12;19:16:05;17:10:00;TARDE;19:16:05;-0.10397,-78.50627;PICHINCHA;QUITO;"EL CONDADO  PARROQUIA EL CONDADO ; CALLE MIGUEL POZO Y RUMIÑAHUI";EL CONDADO;URBANO;EL CONDADO;NO_APLICA;NO APLICA;NO APLICA;NO APLICA;Parque;LUNES;12;SABADO;12;AUTOMOTOR  -  SE DESC  -  SE DESCONOCE  -   S.D.;#¿NOMBRE?;FUERO ORDINARIO;S.D.;S.D.;0;0;0;[];0;1;0;0;0;1;1;0;0;1;SI;NO;NO;ACTIVO;S.D.;S.D.;S.D.;S.D.;S.D.;S.D.;S.D.;17;1701;170110;EXTERNO;S.D.;S.D.;S.D.;S.D.;S.D.;S.D.;S.D.;S.D.;S.D.;S.D.;S.D.;S.D.;S.D.;S.D.;S.D.;S.D.;S.D.;S.D.;S.D.;S.D.;S.D.;S.D.;S.D.;S.D.;S.D.;S.D.;S.D.;S.D.;S.D.;S.D.;S.D.;S.D.;S.D.;S.D.;S.D.;S.D.;S.D.;S.D.;S.D.;S.D.;S.D.;S.D.;S.D.;S.D.;S.D.;S.D.;S.D.;S.D.;S.D.;S.D.;S.D.;S.D.;S.D.;S.D.;S.D.;S.D.;S.D.;S.D.;S.D.;S.D.;S.D.;S.D.;S.D.;S.D.;S.D.;S.D.;S.D.;S.D.;S.D.;S.D.;S.D.;S.D.;S.D.;S.D.;S.D.;S.D.;S.D.;S.D.;S.D.;S.D.
PICHINCHA;QUITO;NORTE - 9 DE OCTUBRE;NORTE - AMAZONAS;BAEZ SOXO FAUSTO WILMO;FISCALIA DE FE  PUBLICA;913466447;ONOFRE MORAN FANNY VERONICA ;FISCALIA DE FE  PUBLICA 1;1,70102E+14;26/08/2016;26/08/2016;2016;2016;FALSIFICACIÓN Y USO DE DOCUMENTO FALSO;NO FLAGRANTE;INVESTIGACION PREVIA;09/09/2016;09/09/2018;-2395;CONSUMADO;ARCHIVO ACEPTADO;10/04/2017 0:00;ARCHIVADA POR ACEPTACION DE SOLICITUD;DENUNCIA FORMAL - ORAL;SN;CON ESTADO;3345;COIP;V - Delitos Contra la Responsabilidad Ciudadana;328;S.D.;2 ANIO;8 MESES;90 DIAS;45 DIAS;FALSIFICACIÓN Y USO DE DOCUMENTO FALSO;Origen Desconocido;S.D.;S.D.;26/08/2016;2016;8;14:13:24;10:00:00;MAÑANA;14:13:24;-0.16086,-78.48331;PICHINCHA;QUITO;CLARO;JIPIJAPA;URBANO;EL INCA;NO_APLICA;NO APLICA;NO APLICA;NO APLICA;S.D.;VIERNES;8;VIERNES;8; -   -   - ; - USD.;FUERO ORDINARIO;16/12/2016;RECHAZADO;1;3;0;[];0;1;0;0;0;1;1;0;0;1;NO;NO;NO;PASIVO;S.D.;S.D.;S.D.;S.D.;S.D.;S.D.;S.D.;17;1701;170114;EXTERNO;PICHINCHA;QUITO;NORTE - 9 DE OCTUBRE;NORTE - AMAZONAS;BAEZ SOXO FAUSTO WILMO;FISCALIA DE FE  PUBLICA;913466447;ONOFRE MORAN FANNY VERONICA;FISCALIA DE FE  PUBLICA 1;1,70102E+14;1,47219E+12;1,47219E+12;2016;2016;FALSIFICACIÓN Y USO DE DOCUMENTO FALSO;NO FLAGRANTE;INVESTIGACION PREVIA;1,4734E+12;1,53647E+12;-2395;CONSUMADO;ARCHIVO ACEPTADO;1,4918E+12;ARCHIVADA POR ACEPTACION DE SOLICITUD;DENUNCIA FORMAL - ORAL;SN;CON ESTADO;3345;COIP;V - Delitos Contra la Responsabilidad Ciudadana;328;S.D.;2 ANIO;8 MESES;90 DIAS;45 DIAS;FALSIFICACIÓN Y USO DE DOCUMENTO FALSO;Origen Desconocido;S.D.;S.D.;1,47219E+12;2016;8;14:13:24;10:00:00;MAÑANA;14:13:24;-0.16086,-78.48331;PICHINCHA;QUITO;CLARO;JIPIJAPA;URBANO;EL INCA;NO_APLICA;NO APLICA;NO APLICA;NO APLICA;S.D.;VIERNES;8;VIERNES;8;-   -   -;#¿NOMBRE?;FUERO ORDINARIO;16/12/2016;RECHAZADO;1;3;0;[];0;1;0;0;0;1;1;0;0;1;NO;NO;NO;PASIVO;S.D.;S.D.;S.D.;S.D.;S.D.;S.D.;S.D.;17;1701;170114;EXTERNO;S.D.;S.D.;S.D.;S.D.;S.D.;S.D.;S.D.;S.D.;S.D.;S.D.;S.D.;S.D.;S.D.;S.D.;S.D.;S.D.;S.D.;S.D.;S.D.;S.D.;S.D.;S.D.;S.D.;S.D.;S.D.;S.D.;S.D.;S.D.;S.D.;S.D.;S.D.;S.D.;S.D.;S.D.;S.D.;S.D.;S.D.;S.D.;S.D.;S.D.;S.D.;S.D.;S.D.;S.D.;S.D.;S.D.;S.D.;S.D.;S.D.;S.D.;S.D.;S.D.;S.D.;S.D.;S.D.;S.D.;S.D.;S.D.;S.D.;S.D.;S.D.;S.D.;S.D.;S.D.;S.D.;S.D.;S.D.;S.D.;S.D.;S.D.;S.D.;S.D.;S.D.;S.D.;S.D.;S.D.;S.D.;S.D.;S.D.;S.D.
SANTA ELENA;SANTA ELENA;UNICA - SANTA ELENA;UNICA - SANTA ELENA;VEGA ACOSTA WILSON ROBERTO;FISCALIA DE VIOLENCIA DE GENERO;603500448;GAVILANES LOPEZ BLANCA ALICIA ;FISCALIA DE VIOLENCIA DE GENERO 1;2,40102E+14;03/10/2018;11/09/2018;2018;2018;INCUMPLIMIENTO DE DECISIONES LEGÍTIMAS DE AUTORIDAD COMPETENTE (VIOLENCIA INTRAFAMILIAR);NO FLAGRANTE;INVESTIGACION PREVIA;08/10/2018;08/10/2019;-2001;CONSUMADO;ARCHIVO ACEPTADO;03/01/2021 0:00;ARCHIVADA POR ACEPTACION DE SOLICITUD;OFICIO DE DELEGACIÓN;CPJ-SE-UJVCMF-TEPG-XR-2018-645-OF;CON ESTADO;3738;COIP;V - Delitos Contra la Responsabilidad Ciudadana;282;S.D.;1 ANIO;4 MESES;90 DIAS;45 DIAS;INCUMPLIMIENTO DE DECISIONES LEGÍTIMAS DE AUTORIDAD COMPETENTE (VIOLENCIA INTRAFAMILIAR);Origen Desconocido;SOLICITUD DE ARCHIVO;18/08/2020;03/10/2018;2018;10;15:54:05;15:00:00;TARDE;15:54:05;-2.22143,-80.70814;SANTA ELENA;SANTA ELENA;"SANTA ELENA (P) ; CANTON SANTA ELENA  UNIDAD JUDICIAL";SANTA ELENA;URBANO;SANTA ELENA;NO_APLICA;NO APLICA;NO APLICA;NO APLICA;S.D.;MIERCOLES;10;MARTES;9; -   -   - ; - USD.;FUERO ORDINARIO;02/09/2021;SOLICITADO;1;3;0;[];0;2;0;0;0;2;0;0;0;1;SI;NO;NO;PASIVO;S.D.;S.D.;S.D.;S.D.;S.D.;S.D.;S.D.;24;2401;240102;EXTERNO;SANTA ELENA;SANTA ELENA;UNICA - SANTA ELENA;UNICA - SANTA ELENA;VEGA ACOSTA WILSON ROBERTO;FISCALIA DE VIOLENCIA DE GENERO;603500448;GAVILANES LOPEZ BLANCA ALICIA;FISCALIA DE VIOLENCIA DE GENERO 1;2,40102E+14;1,53854E+12;1,53664E+12;2018;2018;INCUMPLIMIENTO DE DECISIONES LEGÍTIMAS DE AUTORIDAD COMPETENTE (VIOLENCIA INTRAFAMILIAR);NO FLAGRANTE;INVESTIGACION PREVIA;1,53897E+12;1,57051E+12;-2001;CONSUMADO;ARCHIVO ACEPTADO;1,60965E+12;ARCHIVADA POR ACEPTACION DE SOLICITUD;OFICIO DE DELEGACIÓN;CPJ-SE-UJVCMF-TEPG-XR-2018-645-OF;CON ESTADO;3738;COIP;V - Delitos Contra la Responsabilidad Ciudadana;282;S.D.;1 ANIO;4 MESES;90 DIAS;45 DIAS;INCUMPLIMIENTO DE DECISIONES LEGÍTIMAS DE AUTORIDAD COMPETENTE (VIOLENCIA INTRAFAMILIAR);Origen Desconocido;SOLICITUD DE ARCHIVO;1,59773E+12;1,53854E+12;2018;10;15:54:05;15:00:00;TARDE;15:54:05;-2.22143,-80.70814;SANTA ELENA;SANTA ELENA;"SANTA ELENA (P) ; CANTON SANTA ELENA  UNIDAD JUDICIAL";SANTA ELENA;URBANO;SANTA ELENA;NO_APLICA;NO APLICA;NO APLICA;NO APLICA;S.D.;MIERCOLES;10;MARTES;9;-   -   -;#¿NOMBRE?;FUERO ORDINARIO;02/09/2021;SOLICITADO;1;3;0;[];0;2;0;0;0;2;0;0;0;1;SI;NO;NO;PASIVO;S.D.;S.D.;S.D.;S.D.;S.D.;S.D.;S.D.;24;2401;240102;EXTERNO;S.D.;S.D.;S.D.;S.D.;S.D.;S.D.;S.D.;S.D.;S.D.;S.D.;S.D.;S.D.;S.D.;S.D.;S.D.;S.D.;S.D.;S.D.;S.D.;S.D.;S.D.;S.D.;S.D.;S.D.;S.D.;S.D.;S.D.;S.D.;S.D.;S.D.;S.D.;S.D.;S.D.;S.D.;S.D.;S.D.;S.D.;S.D.;S.D.;S.D.;S.D.;S.D.;S.D.;S.D.;S.D.;S.D.;S.D.;S.D.;S.D.;S.D.;S.D.;S.D.;S.D.;S.D.;S.D.;S.D.;S.D.;S.D.;S.D.;S.D.;S.D.;S.D.;S.D.;S.D.;S.D.;S.D.;S.D.;S.D.;S.D.;S.D.;S.D.;S.D.;S.D.;S.D.;S.D.;S.D.;S.D.;S.D.;S.D.;S.D.
GUAYAS;PEDRO CARBO;UNICA - PEDRO CARBO;UNICA - PEDRO CARBO;CRIOLLO  TIXI JOSE ANTONIO;FISCALIA DE PERSONAS Y GARANTIAS;703216069;MATIAS GONZAGA CESAR FERNANDO ;FISCALIA DE PERSONAS Y GARANTIAS 1;9,14018E+13;07/12/2018;29/11/2018;2018;2018;INCENDIOS FORESTALES Y DE VEGETACIÓN;NO FLAGRANTE;INVESTIGACION PREVIA;12/12/2018;12/12/2019;-1936;CONSUMADO;INVESTIGACION PREVIA;12/12/2018 0:00;ACTIVA;DENUNCIA FORMAL - ESCRITA;SN;CON ESTADO;3395;COIP;IV - Delitos Contra el Ambiente y la Naturaleza o Pacha Mama;246;S.D.;1 ANIO;4 MESES;90 DIAS;45 DIAS;INCENDIOS FORESTALES Y DE VEGETACIÓN;Origen Desconocido;VERSIÓN SOSPECHOSO CARLOS POZO ORTIZ - CI/RUC: 0000000000;12/12/2018;07/12/2018;2018;12;15:56:44;17:00:00;TARDE;15:56:44;-1.82149,-80.23205;GUAYAS;PEDRO CARBO;"PEDRO CARBO ; RECINTO PARAISO DE VILLAO";PEDRO CARBO;URBANO;BARRIO DESCONOCIDO;NO_APLICA;NO APLICA;NO APLICA;NO APLICA;S.D.;VIERNES;12;JUEVES;11; -   -   - ; - USD.;FUERO ORDINARIO;S.D.;S.D.;1;5;0;[];0;2;0;0;0;2;0;0;0;1;NO;SI;NO;ACTIVO;S.D.;S.D.;S.D.;S.D.;S.D.;S.D.;S.D.;9;914;91450;EXTERNO;GUAYAS;PEDRO CARBO;UNICA - PEDRO CARBO;UNICA - PEDRO CARBO;CRIOLLO  TIXI JOSE ANTONIO;FISCALIA DE PERSONAS Y GARANTIAS;703216069;MATIAS GONZAGA CESAR FERNANDO;FISCALIA DE PERSONAS Y GARANTIAS 1;9,14018E+13;1,54416E+12;1,54347E+12;2018;2018;INCENDIOS FORESTALES Y DE VEGETACIÓN;NO FLAGRANTE;INVESTIGACION PREVIA;1,54459E+12;1,57613E+12;-1936;CONSUMADO;INVESTIGACION PREVIA;1,54459E+12;ACTIVA;DENUNCIA FORMAL - ESCRITA;SN;CON ESTADO;3395;COIP;IV - Delitos Contra el Ambiente y la Naturaleza o Pacha Mama;246;S.D.;1 ANIO;4 MESES;90 DIAS;45 DIAS;INCENDIOS FORESTALES Y DE VEGETACIÓN;Origen Desconocido;VERSIÓN SOSPECHOSO CARLOS POZO ORTIZ - CI/RUC: 0000000000;1,54459E+12;1,54416E+12;2018;12;15:56:44;17:00:00;TARDE;15:56:44;-1.82149,-80.23205;GUAYAS;PEDRO CARBO;"PEDRO CARBO ; RECINTO PARAISO DE VILLAO";PEDRO CARBO;URBANO;BARRIO DESCONOCIDO;NO_APLICA;NO APLICA;NO APLICA;NO APLICA;S.D.;VIERNES;12;JUEVES;11;-   -   -;#¿NOMBRE?;FUERO ORDINARIO;S.D.;S.D.;1;5;0;[];0;2;0;0;0;2;0;0;0;1;NO;SI;NO;ACTIVO;S.D.;S.D.;S.D.;S.D.;S.D.;S.D.;S.D.;9;914;91450;EXTERNO;S.D.;S.D.;S.D.;S.D.;S.D.;S.D.;S.D.;S.D.;S.D.;S.D.;S.D.;S.D.;S.D.;S.D.;S.D.;S.D.;S.D.;S.D.;S.D.;S.D.;S.D.;S.D.;S.D.;S.D.;S.D.;S.D.;S.D.;S.D.;S.D.;S.D.;S.D.;S.D.;S.D.;S.D.;S.D.;S.D.;S.D.;S.D.;S.D.;S.D.;S.D.;S.D.;S.D.;S.D.;S.D.;S.D.;S.D.;S.D.;S.D.;S.D.;S.D.;S.D.;S.D.;S.D.;S.D.;S.D.;S.D.;S.D.;S.D.;S.D.;S.D.;S.D.;S.D.;S.D.;S.D.;S.D.;S.D.;S.D.;S.D.;S.D.;S.D.;S.D.;S.D.;S.D.;S.D.;S.D.;S.D.;S.D.;S.D.;S.D.
CANAR;AZOGUES;UNICA - AZOGUES;UNICA - AZOGUES;FLORES CLAVIJO DAYSY MARIANA;FISCALIA DE PATRIMONIO CIUDADANO;301507901;ROJAS CASTRO NUBE XIMENA ;FISCALIA DE PATRIMONIO CIUDADANO 1;3,01018E+13;15/06/2016;14/06/2016;2016;2016;ROBO;NO FLAGRANTE;INVESTIGACION PREVIA;16/06/2016;16/06/2018;-2480;CONSUMADO;ARCHIVO ACEPTADO;23/01/2017 0:00;ARCHIVADA POR ACEPTACION DE SOLICITUD;PARTE DE DETENCION;PJUCP15027773;CON ESTADO;3595;COIP;II - Delitos Contra los Derechos de Libertad;189;S.D.;2 ANIO;8 MESES;90 DIAS;45 DIAS;ROBO;Origen Desconocido;S.D.;S.D.;15/06/2016;2016;6;10:29:33;14:00:00;TARDE;10:29:33;,;CANAR;AZOGUES;JUAN BAUTISTA CORDERO Y ORIENTE;AZOGUES;URBANO;BARRIO UCHUPUCUN;ROBO DE BIENES, ACCESORIOS Y AUTOPARTES DE VEHICULOS;AREAS DE ACCESO PUBLICO;ESTRUCHE;S.D.;Parque;MIERCOLES;6;MARTES;6;AUTOMOTOR  -  LCG0818  -  BLANCO  -   S.D. ;ACCESORIOS DE VEHICULO  - USD. 0.00;FUERO ORDINARIO;09/01/2017;SOLICITADO;1;1;0;[];0;0;0;0;0;0;1;0;0;1;SI;NO;NO;PASIVO;ROBO DE BIENES, ACCESORIOS Y AUTOPARTES DE VEHICULOS;ROBO DE BIENES, ACCESORIOS Y AUTOPARTES DE VEHICULOS;ROBO DE BIENES, ACCESORIOS Y AUTOPARTES DE VEHICULOS;ROBO DE BIENES, ACCESORIOS Y AUTOPARTES DE VEHICULOS;ROBO DE BIENES, ACCESORIOS Y AUTOPARTES DE VEHICULOS;ROBO DE BIENES, ACCESORIOS Y AUTOPARTES DE VEHICULOS;MODELO;3;301;30102;EXTERNO;CANAR;AZOGUES;UNICA - AZOGUES;UNICA - AZOGUES;FLORES CLAVIJO DAYSY MARIANA;FISCALIA DE PATRIMONIO CIUDADANO;301507901;ROJAS CASTRO NUBE XIMENA;FISCALIA DE PATRIMONIO CIUDADANO 1;3,01018E+13;1,46597E+12;1,46588E+12;2016;2016;ROBO;NO FLAGRANTE;INVESTIGACION PREVIA;1,46605E+12;1,52913E+12;-2480;CONSUMADO;ARCHIVO ACEPTADO;1,48515E+12;ARCHIVADA POR ACEPTACION DE SOLICITUD;PARTE DE DETENCION;PJUCP15027773;CON ESTADO;3595;COIP;II - Delitos Contra los Derechos de Libertad;189;S.D.;2 ANIO;8 MESES;90 DIAS;45 DIAS;ROBO;Origen Desconocido;S.D.;S.D.;1,46597E+12;2016;6;10:29:33;14:00:00;TARDE;10:29:33;S.D.;CANAR;AZOGUES;JUAN BAUTISTA CORDERO Y ORIENTE;AZOGUES;URBANO;BARRIO UCHUPUCUN;ROBO DE BIENES, ACCESORIOS Y AUTOPARTES DE VEHICULOS;AREAS DE ACCESO PUBLICO;ESTRUCHE;S.D.;Parque;MIERCOLES;6;MARTES;6;AUTOMOTOR  -  LCG0818  -  BLANCO  -   S.D.;ACCESORIOS DE VEHICULO  - USD. 0.00;FUERO ORDINARIO;09/01/2017;SOLICITADO;1;1;0;[];0;0;0;0;0;0;1;0;0;1;SI;NO;NO;PASIVO;ROBO DE BIENES, ACCESORIOS Y AUTOPARTES DE VEHICULOS;ROBO DE BIENES, ACCESORIOS Y AUTOPARTES DE VEHICULOS;ROBO DE BIENES, ACCESORIOS Y AUTOPARTES DE VEHICULOS;ROBO DE BIENES, ACCESORIOS Y AUTOPARTES DE VEHICULOS;ROBO DE BIENES, ACCESORIOS Y AUTOPARTES DE VEHICULOS;ROBO DE BIENES, ACCESORIOS Y AUTOPARTES DE VEHICULOS;MODELO;3;301;30102;EXTERNO;S.D.;S.D.;S.D.;S.D.;S.D.;S.D.;S.D.;S.D.;S.D.;S.D.;S.D.;S.D.;S.D.;S.D.;S.D.;S.D.;S.D.;S.D.;S.D.;S.D.;S.D.;S.D.;S.D.;S.D.;S.D.;S.D.;S.D.;S.D.;S.D.;S.D.;S.D.;S.D.;S.D.;S.D.;S.D.;S.D.;S.D.;S.D.;S.D.;S.D.;S.D.;S.D.;S.D.;S.D.;S.D.;S.D.;S.D.;S.D.;S.D.;S.D.;S.D.;S.D.;S.D.;S.D.;S.D.;S.D.;S.D.;S.D.;S.D.;S.D.;S.D.;S.D.;S.D.;S.D.;S.D.;S.D.;S.D.;S.D.;S.D.;S.D.;S.D.;S.D.;S.D.;S.D.;S.D.;S.D.;S.D.;S.D.;S.D.;S.D.
