GUAYAS;GUAYAQUIL;EDIFICIO LA MERCED;UNIDAD JUDICIAL DE FLAGRANCIA – UVC CUARTEL MODELO;RUIZ CERRUFFO IRMA ELSA;FISCALIA DE PERSONAS Y GARANTIAS;924488786;CAICHE MEJILLON JORGE EDUARDO ;FISCALIA DE PERSONAS Y GARANTIAS 9;9,01018E+13;08/08/2024;27/07/2024;2024;2024;ASESINATO;NO FLAGRANTE;INVESTIGACION PREVIA;14/08/2024;14/08/2026;501;CONSUMADO;INVESTIGACION PREVIA;14/08/2024 0:00;ACTIVA;ACTA DE LEVANTAMIENTO DEL CADAVER;2,02407E+14;CON ESTADO;3068;COIP;II - Delitos Contra los Derechos de Libertad;140;S.D.;2 ANIO;8 MESES;90 DIAS;45 DIAS;ASESINATO;Origen Desconocido;REQUERIMIENTO DE INFORME ;15/08/2024;08/08/2024;2024;8;15:50:27;12:30:00;TARDE;15:50:27;-2.07739,-79.93455;GUAYAS;GUAYAQUIL;"PASCUALES ; FORTIN BLOQUE 3 MZ 1376";PASCUALES;RURAL;PASCUALES;NO_APLICA;NO APLICA;NO APLICA;NO APLICA;Parque;JUEVES;8;SABADO;7; -   -   - ; - USD.;FUERO ORDINARIO;S.D.;S.D.;2;5;0;[];0;0;0;0;0;0;0;0;1;1;SI;NO;NO;ACTIVO;S.D.;S.D.;S.D.;S.D.;S.D.;S.D.;S.D.;9;901;90154;EXTERNO;GUAYAS;GUAYAQUIL;EDIFICIO LA MERCED;UNIDAD JUDICIAL DE FLAGRANCIA – UVC CUARTEL MODELO;RUIZ CERRUFFO IRMA ELSA;FISCALIA DE PERSONAS Y GARANTIAS;924488786;CAICHE MEJILLON JORGE EDUARDO;FISCALIA DE PERSONAS Y GARANTIAS 9;9,01018E+13;1,72309E+12;1,72206E+12;2024;2024;ASESINATO;NO FLAGRANTE;INVESTIGACION PREVIA;1,72361E+12;1,78668E+12;501;CONSUMADO;INVESTIGACION PREVIA;1,72361E+12;ACTIVA;ACTA DE LEVANTAMIENTO DEL CADAVER;2,02407E+14;CON ESTADO;3068;COIP;II - Delitos Contra los Derechos de Libertad;140;S.D.;2 ANIO;8 MESES;90 DIAS;45 DIAS;ASESINATO;Origen Desconocido;REQUERIMIENTO DE INFORME;1,7237E+12;1,72309E+12;2024;8;15:50:27;12:30:00;TARDE;15:50:27;-2.07739,-79.93455;GUAYAS;GUAYAQUIL;"PASCUALES ; FORTIN BLOQUE 3 MZ 1376";PASCUALES;RURAL;PASCUALES;NO_APLICA;NO APLICA;NO APLICA;NO APLICA;Parque;JUEVES;8;SABADO;7;-   -   -;#¿NOMBRE?;FUERO ORDINARIO;S.D.;S.D.;2;5;0;[];0;0;0;0;0;0;0;0;1;1;SI;NO;NO;ACTIVO;S.D.;S.D.;S.D.;S.D.;S.D.;S.D.;S.D.;9;901;90154;EXTERNO;S.D.;S.D.;S.D.;S.D.;S.D.;S.D.;S.D.;S.D.;S.D.;S.D.;S.D.;S.D.;S.D.;S.D.;S.D.;S.D.;S.D.;S.D.;S.D.;S.D.;S.D.;S.D.;S.D.;S.D.;S.D.;S.D.;S.D.;S.D.;S.D.;S.D.;S.D.;S.D.;S.D.;S.D.;S.D.;S.D.;S.D.;S.D.;S.D.;S.D.;S.D.;S.D.;S.D.;S.D.;S.D.;S.D.;S.D.;S.D.;S.D.;S.D.;S.D.;S.D.;S.D.;S.D.;S.D.;S.D.;S.D.;S.D.;S.D.;S.D.;S.D.;S.D.;S.D.;S.D.;S.D.;S.D.;S.D.;S.D.;S.D.;S.D.;S.D.;S.D.;S.D.;S.D.;S.D.;S.D.;S.D.;S.D.;S.D.;S.D.
GUAYAS;GUAYAQUIL;EDIFICIO MONTECRISTI - GYE;UNIDAD JUDICIAL DE FLAGRANCIA – UVC CUARTEL MODELO;DIOSES MURILLO MARCOS JAVIER;FISCALIA DE SOLUCIONES RAPIDAS;603983149;CASTAÑEDA PEÑA EDWIN ROLANDO ;FISCALIA DE SOLUCIONES RAPIDAS 1;9,01018E+13;21/09/2016;06/06/2016;2016;2016;HURTO;NO FLAGRANTE;INVESTIGACION PREVIA;13/06/2016;30/11/2016;-3043;CONSUMADO;ARCHIVO ACEPTADO;09/07/2019 0:00;ARCHIVADA POR ACEPTACION DE SOLICITUD;DENUNCIA FORMAL - ORAL;SN;CON ESTADO;3387;COIP;II - Delitos Contra los Derechos de Libertad;196;S.D.;1 ANIO;4 MESES;90 DIAS;45 DIAS;HURTO;Origen Desconocido;SOLICITUD DE ARCHIVO;22/01/2019;06/06/2016;2016;6;15:06:09;6:50:00;MAÑANA;15:06:09;,;GUAYAS;GUAYAQUIL;los rios 200 y alejo lascano;TARQUI SUR;URBANO;TARQUI SUR;HURTO A DOMICILIO;VIVIENDA/ALOJAMIENTO;NO APLICA;S.D.;S.D.;MIERCOLES;9;LUNES;6; -   -   - ;DINERO  - USD. 1200.00;FUERO ORDINARIO;22/01/2019;SOLICITADO;1;2;0;[];0;1;0;0;0;1;0;0;0;1;NO;NO;NO;PASIVO;S.D.;S.D.;S.D.;S.D.;S.D.;S.D.;S.D.;9;901;90149;EXTERNO;GUAYAS;GUAYAQUIL;EDIFICIO MONTECRISTI - GYE;UNIDAD JUDICIAL DE FLAGRANCIA – UVC CUARTEL MODELO;DIOSES MURILLO MARCOS JAVIER;FISCALIA DE SOLUCIONES RAPIDAS;603983149;CASTAÑEDA PEÑA EDWIN ROLANDO;FISCALIA DE SOLUCIONES RAPIDAS 1;9,01018E+13;1,47443E+12;1,46519E+12;2016;2016;HURTO;NO FLAGRANTE;INVESTIGACION PREVIA;1,46579E+12;1,48048E+12;-3043;CONSUMADO;ARCHIVO ACEPTADO;1,56265E+12;ARCHIVADA POR ACEPTACION DE SOLICITUD;DENUNCIA FORMAL - ORAL;SN;CON ESTADO;3387;COIP;II - Delitos Contra los Derechos de Libertad;196;S.D.;1 ANIO;4 MESES;90 DIAS;45 DIAS;HURTO;Origen Desconocido;SOLICITUD DE ARCHIVO;1,54813E+12;1,46519E+12;2016;6;15:06:09;6:50:00;MAÑANA;15:06:09;S.D.;GUAYAS;GUAYAQUIL;los rios 200 y alejo lascano;TARQUI SUR;URBANO;TARQUI SUR;HURTO A DOMICILIO;VIVIENDA/ALOJAMIENTO;NO APLICA;S.D.;S.D.;MIERCOLES;9;LUNES;6;-   -   -;DINERO  - USD. 1200.00;FUERO ORDINARIO;22/01/2019;SOLICITADO;1;2;0;[];0;1;0;0;0;1;0;0;0;1;NO;NO;NO;PASIVO;S.D.;S.D.;S.D.;S.D.;S.D.;S.D.;S.D.;9;901;90149;EXTERNO;S.D.;S.D.;S.D.;S.D.;S.D.;S.D.;S.D.;S.D.;S.D.;S.D.;S.D.;S.D.;S.D.;S.D.;S.D.;S.D.;S.D.;S.D.;S.D.;S.D.;S.D.;S.D.;S.D.;S.D.;S.D.;S.D.;S.D.;S.D.;S.D.;S.D.;S.D.;S.D.;S.D.;S.D.;S.D.;S.D.;S.D.;S.D.;S.D.;S.D.;S.D.;S.D.;S.D.;S.D.;S.D.;S.D.;S.D.;S.D.;S.D.;S.D.;S.D.;S.D.;S.D.;S.D.;S.D.;S.D.;S.D.;S.D.;S.D.;S.D.;S.D.;S.D.;S.D.;S.D.;S.D.;S.D.;S.D.;S.D.;S.D.;S.D.;S.D.;S.D.;S.D.;S.D.;S.D.;S.D.;S.D.;S.D.;S.D.;S.D.
ESMERALDAS;QUININDE;UNICA - QUININDE;UNICA - QUININDE;MACIAS VELEZ JESSICA PATRICIA;FISCALIA DE VIOLENCIA DE GENERO;602980849;BADILLO BARRENO ANGEL EDUARDO ;FISCALIA DE VIOLENCIA DE GENERO 3;8,04018E+13;25/06/2018;15/06/2018;2018;2018;VIOLENCIA PSICOLÓGICA CONTRA LA MUJER O MIEMBROS DEL NÚCLEO FAMILIAR;NO FLAGRANTE;INVESTIGACION PREVIA;02/07/2018;02/07/2019;-2099;CONSUMADO;ARCHIVO SOLICITADO;05/11/2019 13:59;ACTIVA;DENUNCIA FORMAL - ORAL;SN;CON ESTADO;3733;COIP;II - Delitos Contra los Derechos de Libertad;157;S.D.;1 ANIO;4 MESES;90 DIAS;45 DIAS;VIOLENCIA PSICOLÓGICA CONTRA LA MUJER O MIEMBROS DEL NÚCLEO FAMILIAR;Origen Desconocido;SOLICITUD DE ARCHIVO;05/11/2019;25/06/2018;2018;6;14:56:53;10:00:00;MAÑANA;14:56:53;-79.56437,-79.56437;ESMERALDAS;QUININDE;"VICHE (P) ; SAN FRANCISCO";VICHE;RURAL;BARRIO NUEVO VICHE;NO_APLICA;NO APLICA;NO APLICA;NO APLICA;S.D.;LUNES;6;VIERNES;6; -   -   - ; - USD.;FUERO ORDINARIO;19/10/2019;RECHAZADO;1;3;1;[3. Prohibición a la persona procesada de realizar actos de persecución o de intimidación a la víctima o a miembros del núcleo familiar por sí mismo o a través de terceros., 4. Extensión de una boleta de auxilio a favor de la víctima o de miembros del núcleo familiar en el caso de violencia contra la mujer o miembros del núcleo familiar. ];0;1;0;0;0;1;1;0;0;1;NO;NO;NO;PASIVO;S.D.;S.D.;S.D.;S.D.;S.D.;S.D.;S.D.;8;804;80454;EXTERNO;ESMERALDAS;QUININDE;UNICA - QUININDE;UNICA - QUININDE;MACIAS VELEZ JESSICA PATRICIA;FISCALIA DE VIOLENCIA DE GENERO;602980849;BADILLO BARRENO ANGEL EDUARDO;FISCALIA DE VIOLENCIA DE GENERO 3;8,04018E+13;1,5299E+12;1,52904E+12;2018;2018;VIOLENCIA PSICOLÓGICA CONTRA LA MUJER O MIEMBROS DEL NÚCLEO FAMILIAR;NO FLAGRANTE;INVESTIGACION PREVIA;1,53051E+12;1,56204E+12;-2099;CONSUMADO;ARCHIVO SOLICITADO;1,57293E+12;ACTIVA;DENUNCIA FORMAL - ORAL;SN;CON ESTADO;3733;COIP;II - Delitos Contra los Derechos de Libertad;157;S.D.;1 ANIO;4 MESES;90 DIAS;45 DIAS;VIOLENCIA PSICOLÓGICA CONTRA LA MUJER O MIEMBROS DEL NÚCLEO FAMILIAR;Origen Desconocido;SOLICITUD DE ARCHIVO;1,57293E+12;1,5299E+12;2018;6;14:56:53;10:00:00;MAÑANA;14:56:53;-79.56437,-79.56437;ESMERALDAS;QUININDE;"VICHE (P) ; SAN FRANCISCO";VICHE;RURAL;BARRIO NUEVO VICHE;NO_APLICA;NO APLICA;NO APLICA;NO APLICA;S.D.;LUNES;6;VIERNES;6;-   -   -;#¿NOMBRE?;FUERO ORDINARIO;19/10/2019;RECHAZADO;1;3;1;[3. Prohibición a la persona procesada de realizar actos de persecución o de intimidación a la víctima o a miembros del núcleo familiar por sí mismo o a través de terceros., 4. Extensión de una boleta de auxilio a favor de la víctima o de miembros del núcleo familiar en el caso de violencia contra la mujer o miembros del núcleo familiar. ];0;1;0;0;0;1;1;0;0;1;NO;NO;NO;PASIVO;S.D.;S.D.;S.D.;S.D.;S.D.;S.D.;S.D.;8;804;80454;EXTERNO;S.D.;S.D.;S.D.;S.D.;S.D.;S.D.;S.D.;S.D.;S.D.;S.D.;S.D.;S.D.;S.D.;S.D.;S.D.;S.D.;S.D.;S.D.;S.D.;S.D.;S.D.;S.D.;S.D.;S.D.;S.D.;S.D.;S.D.;S.D.;S.D.;S.D.;S.D.;S.D.;S.D.;S.D.;S.D.;S.D.;S.D.;S.D.;S.D.;S.D.;S.D.;S.D.;S.D.;S.D.;S.D.;S.D.;S.D.;S.D.;S.D.;S.D.;S.D.;S.D.;S.D.;S.D.;S.D.;S.D.;S.D.;S.D.;S.D.;S.D.;S.D.;S.D.;S.D.;S.D.;S.D.;S.D.;S.D.;S.D.;S.D.;S.D.;S.D.;S.D.;S.D.;S.D.;S.D.;S.D.;S.D.;S.D.;S.D.;S.D.
ESMERALDAS;QUININDE;UNICA - QUININDE;ESMERALDAS 2;MUÑOZ  COELLO CARLOS ANTONIO;FISCALIA DE VIOLENCIA DE GENERO;602980849;BADILLO BARRENO ANGEL EDUARDO ;FISCALIA DE VIOLENCIA DE GENERO 2;8,04018E+13;02/03/2021;02/03/2021;2021;2021;ACOSO SEXUAL;NO FLAGRANTE;INVESTIGACION PREVIA;04/03/2021;04/03/2022;-1123;CONSUMADO;INVESTIGACION PREVIA;04/03/2021 0:00;ACTIVA;DENUNCIA FORMAL - ORAL;SN;CON ESTADO;3030;COIP;II - Delitos Contra los Derechos de Libertad;166;S.D.;1 ANIO;4 MESES;90 DIAS;45 DIAS;ACOSO SEXUAL;Origen Desconocido;IMPULSO FISCAL;10/09/2021;02/03/2021;2021;3;15:25:37;15:25:37;TARDE;15:25:37;-79.47069,-79.47069;ESMERALDAS;QUININDE;"QUININDE ; BARRIO 1 DE JUNIO SECTOR NUEVO QUININDÉ";ROSA ZARATE;URBANO;CENTRAL;NO_APLICA;NO APLICA;NO APLICA;NO APLICA;Oficina;MARTES;3;MARTES;3; -   -   - ; - USD.;FUERO ORDINARIO;S.D.;S.D.;1;3;0;[];0;1;0;0;0;1;1;0;0;1;NO;SI;NO;ACTIVO;S.D.;S.D.;S.D.;S.D.;S.D.;S.D.;S.D.;8;804;80459;EXTERNO;ESMERALDAS;QUININDE;UNICA - QUININDE;ESMERALDAS 2;MUÑOZ  COELLO CARLOS ANTONIO;FISCALIA DE VIOLENCIA DE GENERO;602980849;BADILLO BARRENO ANGEL EDUARDO;FISCALIA DE VIOLENCIA DE GENERO 2;8,04018E+13;1,61466E+12;1,61466E+12;2021;2021;ACOSO SEXUAL;NO FLAGRANTE;INVESTIGACION PREVIA;1,61483E+12;1,64637E+12;-1123;CONSUMADO;INVESTIGACION PREVIA;1,61483E+12;ACTIVA;DENUNCIA FORMAL - ORAL;SN;CON ESTADO;3030;COIP;II - Delitos Contra los Derechos de Libertad;166;S.D.;1 ANIO;4 MESES;90 DIAS;45 DIAS;ACOSO SEXUAL;Origen Desconocido;IMPULSO FISCAL;1,63125E+12;1,61466E+12;2021;3;15:25:37;15:25:37;TARDE;15:25:37;-79.47069,-79.47069;ESMERALDAS;QUININDE;"QUININDE ; BARRIO 1 DE JUNIO SECTOR NUEVO QUININDÉ";ROSA ZARATE;URBANO;CENTRAL;NO_APLICA;NO APLICA;NO APLICA;NO APLICA;Oficina;MARTES;3;MARTES;3;-   -   -;#¿NOMBRE?;FUERO ORDINARIO;S.D.;S.D.;1;3;0;[];0;1;0;0;0;1;1;0;0;1;NO;SI;NO;ACTIVO;S.D.;S.D.;S.D.;S.D.;S.D.;S.D.;S.D.;8;804;80459;EXTERNO;S.D.;S.D.;S.D.;S.D.;S.D.;S.D.;S.D.;S.D.;S.D.;S.D.;S.D.;S.D.;S.D.;S.D.;S.D.;S.D.;S.D.;S.D.;S.D.;S.D.;S.D.;S.D.;S.D.;S.D.;S.D.;S.D.;S.D.;S.D.;S.D.;S.D.;S.D.;S.D.;S.D.;S.D.;S.D.;S.D.;S.D.;S.D.;S.D.;S.D.;S.D.;S.D.;S.D.;S.D.;S.D.;S.D.;S.D.;S.D.;S.D.;S.D.;S.D.;S.D.;S.D.;S.D.;S.D.;S.D.;S.D.;S.D.;S.D.;S.D.;S.D.;S.D.;S.D.;S.D.;S.D.;S.D.;S.D.;S.D.;S.D.;S.D.;S.D.;S.D.;S.D.;S.D.;S.D.;S.D.;S.D.;S.D.;S.D.;S.D.
EL ORO;MACHALA;UNICA - MACHALA;UNICA - MACHALA;BUSTAMANTE ACARO GLENDA ROCÍO;FISCALIA DE PATRIMONIO CIUDADANO;701471609;VERA CHAVEZ CARLOS JULIO ;FISCALIA DE PATRIMONIO CIUDADANO 2;7,01018E+13;16/03/2022;23/02/2022;2022;2022;ROBO  SI EL DELITO SE COMETE SOBRE BIENES PÚBLICOS;NO FLAGRANTE;INVESTIGACION PREVIA;17/03/2022;16/03/2024;-380;CONSUMADO;ARCHIVO SOLICITADO;09/09/2024 10:34;ACTIVA;DENUNCIA FORMAL - ESCRITA;SN;CON ESTADO;3599;COIP;II - Delitos Contra los Derechos de Libertad;189;189 INC. 5;2 ANIO;8 MESES;90 DIAS;45 DIAS;ROBO;Origen Desconocido;SOLICITUD DE ARCHIVO;09/09/2024;16/03/2022;2022;3;9:55:46;12:50:00;TARDE;9:55:46;-3.25879,-79.95946;EL ORO;MACHALA;"PARQUE JUAN MONTALVO ; UHZCURRUMI";MACHALA;URBANO;CENTRO DE MACHALA;ROBO A BIENES DE INSTITUCION PUBLICA;AREAS DE ACCESO PUBLICO;ARRANCHADORES;DESCONOCE;Parque;MIERCOLES;3;MIERCOLES;2; -   -   - ; - USD.;FUERO ORDINARIO;09/09/2024;RECHAZADO;1;2;0;[];0;0;0;0;0;0;0;0;0;1;SI;NO;NO;PASIVO;ROBO DE BIENES, ACCESORIOS Y AUTOPARTES DE VEHICULOS;ROBO DE BIENES, ACCESORIOS Y AUTOPARTES DE VEHICULOS;SIN INFORMACION;ROBO DE BIENES, ACCESORIOS Y AUTOPARTES DE VEHICULOS;OTROS ROBOS;OTROS ROBOS;MODELO;7;701;70102;EXTERNO;EL ORO;MACHALA;UNICA - MACHALA;UNICA - MACHALA;BUSTAMANTE ACARO GLENDA ROCÍO;FISCALIA DE PATRIMONIO CIUDADANO;701471609;VERA CHAVEZ CARLOS JULIO;FISCALIA DE PATRIMONIO CIUDADANO 2;7,01018E+13;1,64741E+12;1,64559E+12;2022;2022;ROBO  SI EL DELITO SE COMETE SOBRE BIENES PÚBLICOS;NO FLAGRANTE;INVESTIGACION PREVIA;1,64749E+12;1,71057E+12;-380;CONSUMADO;ARCHIVO SOLICITADO;1,72586E+12;ACTIVA;DENUNCIA FORMAL - ESCRITA;SN;CON ESTADO;3599;COIP;II - Delitos Contra los Derechos de Libertad;189;189 INC. 5;2 ANIO;8 MESES;90 DIAS;45 DIAS;ROBO;Origen Desconocido;SOLICITUD DE ARCHIVO;1,72586E+12;1,64741E+12;2022;3;9:55:46;12:50:00;TARDE;9:55:46;-3.25879,-79.95946;EL ORO;MACHALA;"PARQUE JUAN MONTALVO ; UHZCURRUMI";MACHALA;URBANO;CENTRO DE MACHALA;ROBO A BIENES DE INSTITUCION PUBLICA;AREAS DE ACCESO PUBLICO;ARRANCHADORES;DESCONOCE;Parque;MIERCOLES;3;MIERCOLES;2;-   -   -;#¿NOMBRE?;FUERO ORDINARIO;09/09/2024;RECHAZADO;1;2;0;[];0;0;0;0;0;0;0;0;0;1;SI;NO;NO;PASIVO;ROBO DE BIENES, ACCESORIOS Y AUTOPARTES DE VEHICULOS;ROBO DE BIENES, ACCESORIOS Y AUTOPARTES DE VEHICULOS;SIN INFORMACION;ROBO DE BIENES, ACCESORIOS Y AUTOPARTES DE VEHICULOS;OTROS ROBOS;OTROS ROBOS;MODELO;7;701;70102;EXTERNO;S.D.;S.D.;S.D.;S.D.;S.D.;S.D.;S.D.;S.D.;S.D.;S.D.;S.D.;S.D.;S.D.;S.D.;S.D.;S.D.;S.D.;S.D.;S.D.;S.D.;S.D.;S.D.;S.D.;S.D.;S.D.;S.D.;S.D.;S.D.;S.D.;S.D.;S.D.;S.D.;S.D.;S.D.;S.D.;S.D.;S.D.;S.D.;S.D.;S.D.;S.D.;S.D.;S.D.;S.D.;S.D.;S.D.;S.D.;S.D.;S.D.;S.D.;S.D.;S.D.;S.D.;S.D.;S.D.;S.D.;S.D.;S.D.;S.D.;S.D.;S.D.;S.D.;S.D.;S.D.;S.D.;S.D.;S.D.;S.D.;S.D.;S.D.;S.D.;S.D.;S.D.;S.D.;S.D.;S.D.;S.D.;S.D.;S.D.;S.D.
GUAYAS;DAULE;UNICA - DAULE;UNICA - DAULE;VEGA SANCHEZ KLEVER RICARDO;FISCALIA DE PATRIMONIO CIUDADANO;905954806;BAQUERIZO BALLADARES NARCISA MIXILI ;FISCALIA DE PATRIMONIO CIUDADANO 2;9,06018E+13;30/05/2017;29/05/2017;2017;2017;ROBO;NO FLAGRANTE;INVESTIGACION PREVIA;30/05/2017;30/05/2019;-2132;CONSUMADO;INVESTIGACION PREVIA;30/05/2017 0:00;ACTIVA;DENUNCIA FORMAL - ORAL;SN;CON ESTADO;3595;COIP;II - Delitos Contra los Derechos de Libertad;189;S.D.;2 ANIO;8 MESES;90 DIAS;45 DIAS;ROBO;Origen Desconocido;S.D.;S.D.;30/05/2017;2017;5;9:22:48;20:00:00;NOCHE;9:22:48;-1.80993,-79.9833;GUAYAS;DAULE;RECINTO EL PRADO;DAULE;URBANO;BRISAS DE DAULE;ROBO DE MOTOS;AREAS DE ACCESO PUBLICO;ASALTO;ARMA DE FUEGO;Parque;MARTES;5;LUNES;5; -   -   - ; - USD.;FUERO ORDINARIO;S.D.;S.D.;1;3;0;[];0;0;0;0;0;0;1;0;0;1;NO;NO;NO;ACTIVO;ROBO DE MOTOS;ROBO DE MOTOS;ROBO DE MOTOS;ROBO DE MOTOS;ROBO DE MOTOS;ROBO DE MOTOS;MODELO;9;906;90601;EXTERNO;GUAYAS;DAULE;UNICA - DAULE;UNICA - DAULE;VEGA SANCHEZ KLEVER RICARDO;FISCALIA DE PATRIMONIO CIUDADANO;905954806;BAQUERIZO BALLADARES NARCISA MIXILI;FISCALIA DE PATRIMONIO CIUDADANO 2;9,06018E+13;1,49612E+12;1,49603E+12;2017;2017;ROBO;NO FLAGRANTE;INVESTIGACION PREVIA;1,49612E+12;1,55919E+12;-2132;CONSUMADO;INVESTIGACION PREVIA;1,49612E+12;ACTIVA;DENUNCIA FORMAL - ORAL;SN;CON ESTADO;3595;COIP;II - Delitos Contra los Derechos de Libertad;189;S.D.;2 ANIO;8 MESES;90 DIAS;45 DIAS;ROBO;Origen Desconocido;S.D.;S.D.;1,49612E+12;2017;5;9:22:48;20:00:00;NOCHE;9:22:48;-1.80993,-79.9833;GUAYAS;DAULE;RECINTO EL PRADO;DAULE;URBANO;BRISAS DE DAULE;ROBO DE MOTOS;AREAS DE ACCESO PUBLICO;ASALTO;ARMA DE FUEGO;Parque;MARTES;5;LUNES;5;-   -   -;#¿NOMBRE?;FUERO ORDINARIO;S.D.;S.D.;1;3;0;[];0;0;0;0;0;0;1;0;0;1;NO;NO;NO;ACTIVO;ROBO DE MOTOS;ROBO DE MOTOS;ROBO DE MOTOS;ROBO DE MOTOS;ROBO DE MOTOS;ROBO DE MOTOS;MODELO;9;906;90601;EXTERNO;S.D.;S.D.;S.D.;S.D.;S.D.;S.D.;S.D.;S.D.;S.D.;S.D.;S.D.;S.D.;S.D.;S.D.;S.D.;S.D.;S.D.;S.D.;S.D.;S.D.;S.D.;S.D.;S.D.;S.D.;S.D.;S.D.;S.D.;S.D.;S.D.;S.D.;S.D.;S.D.;S.D.;S.D.;S.D.;S.D.;S.D.;S.D.;S.D.;S.D.;S.D.;S.D.;S.D.;S.D.;S.D.;S.D.;S.D.;S.D.;S.D.;S.D.;S.D.;S.D.;S.D.;S.D.;S.D.;S.D.;S.D.;S.D.;S.D.;S.D.;S.D.;S.D.;S.D.;S.D.;S.D.;S.D.;S.D.;S.D.;S.D.;S.D.;S.D.;S.D.;S.D.;S.D.;S.D.;S.D.;S.D.;S.D.;S.D.;S.D.
SANTA ELENA;SALINAS;UNICA - SALINAS;UNICA - SALINAS;MATIAS OROZCO FELIX ANDRES;FISCALIA DE SOLUCIONES RAPIDAS;1202305932;SANCHEZ GERMAN DAVID ALBERTO ;FISCALIA DE SOLUCIONES RAPIDAS 1;2,40302E+14;18/07/2016;18/07/2016;2016;2016;VIOLACIÓN DE PROPIEDAD PRIVADA;NO FLAGRANTE;INVESTIGACION PREVIA;19/07/2016;19/07/2017;-2812;CONSUMADO;ARCHIVO SOLICITADO;04/04/2020 17:40;ACTIVA;DENUNCIA FORMAL - ORAL;SN;CON ESTADO;3723;COIP;II - Delitos Contra los Derechos de Libertad;181;S.D.;1 ANIO;4 MESES;90 DIAS;45 DIAS;VIOLACIÓN DE PROPIEDAD PRIVADA;Origen Desconocido;SOLICITUD DE ARCHIVO;04/04/2020;18/07/2016;2016;7;10:56:30;1:00:00;MADRUGADA;10:56:30;-2.27601,-80.89852;SANTA ELENA;SALINAS;"JOSE LUIS TAMAYO (MUEY) (P) ; CIUDADELA COSTA DE ORO MZ B SOLAR 10";JOSE LUIS TAMAYO (MUEY);URBANO;CAROLINA;NO_APLICA;NO APLICA;NO APLICA;NO APLICA;S.D.;LUNES;7;LUNES;7; -   -   - ; - USD.;FUERO ORDINARIO;04/04/2020;RECHAZADO;1;2;0;[];0;1;0;0;0;1;1;0;0;1;NO;NO;NO;PASIVO;S.D.;S.D.;S.D.;S.D.;S.D.;S.D.;S.D.;24;2403;240352;EXTERNO;SANTA ELENA;SALINAS;UNICA - SALINAS;UNICA - SALINAS;MATIAS OROZCO FELIX ANDRES;FISCALIA DE SOLUCIONES RAPIDAS;1202305932;SANCHEZ GERMAN DAVID ALBERTO;FISCALIA DE SOLUCIONES RAPIDAS 1;2,40302E+14;1,46882E+12;1,46882E+12;2016;2016;VIOLACIÓN DE PROPIEDAD PRIVADA;NO FLAGRANTE;INVESTIGACION PREVIA;1,4689E+12;1,50044E+12;-2812;CONSUMADO;ARCHIVO SOLICITADO;1,58598E+12;ACTIVA;DENUNCIA FORMAL - ORAL;SN;CON ESTADO;3723;COIP;II - Delitos Contra los Derechos de Libertad;181;S.D.;1 ANIO;4 MESES;90 DIAS;45 DIAS;VIOLACIÓN DE PROPIEDAD PRIVADA;Origen Desconocido;SOLICITUD DE ARCHIVO;1,58598E+12;1,46882E+12;2016;7;10:56:30;1:00:00;MADRUGADA;10:56:30;-2.27601,-80.89852;SANTA ELENA;SALINAS;"JOSE LUIS TAMAYO (MUEY) (P) ; CIUDADELA COSTA DE ORO MZ B SOLAR 10";JOSE LUIS TAMAYO (MUEY);URBANO;CAROLINA;NO_APLICA;NO APLICA;NO APLICA;NO APLICA;S.D.;LUNES;7;LUNES;7;-   -   -;#¿NOMBRE?;FUERO ORDINARIO;04/04/2020;RECHAZADO;1;2;0;[];0;1;0;0;0;1;1;0;0;1;NO;NO;NO;PASIVO;S.D.;S.D.;S.D.;S.D.;S.D.;S.D.;S.D.;24;2403;240352;EXTERNO;S.D.;S.D.;S.D.;S.D.;S.D.;S.D.;S.D.;S.D.;S.D.;S.D.;S.D.;S.D.;S.D.;S.D.;S.D.;S.D.;S.D.;S.D.;S.D.;S.D.;S.D.;S.D.;S.D.;S.D.;S.D.;S.D.;S.D.;S.D.;S.D.;S.D.;S.D.;S.D.;S.D.;S.D.;S.D.;S.D.;S.D.;S.D.;S.D.;S.D.;S.D.;S.D.;S.D.;S.D.;S.D.;S.D.;S.D.;S.D.;S.D.;S.D.;S.D.;S.D.;S.D.;S.D.;S.D.;S.D.;S.D.;S.D.;S.D.;S.D.;S.D.;S.D.;S.D.;S.D.;S.D.;S.D.;S.D.;S.D.;S.D.;S.D.;S.D.;S.D.;S.D.;S.D.;S.D.;S.D.;S.D.;S.D.;S.D.;S.D.
MANABI;SANTA ANA;UNICA - SANTA ANA;UNICA - SANTA ANA;ZAMBRANO AVEIGA CARLA VIVIANA;FISCALIA DE PATRIMONIO CIUDADANO;1801957034;CASTILLO GILER LUIS JACINTO ;FISCALIA DE PATRIMONIO CIUDADANO 1;1,31302E+14;07/09/2020;17/05/2020;2020;2020;ROBO;NO FLAGRANTE;INVESTIGACION PREVIA;07/09/2020;07/09/2022;-936;CONSUMADO;INVESTIGACION PREVIA;07/09/2020 0:00;ACTIVA;DENUNCIA FORMAL - ESCRITA;SN;CON ESTADO;3595;COIP;II - Delitos Contra los Derechos de Libertad;189;S.D.;2 ANIO;8 MESES;90 DIAS;45 DIAS;ROBO;Origen Desconocido;VERSIONES FISCALIA ;07/09/2020;07/09/2020;2020;9;9:02:39;14:40:00;TARDE;9:02:39;-1.20695,-80.37144;MANABI;SANTA ANA;"SANTA ANA ; VIA SANTA ANA";SANTA ANA;URBANO;SANTA ANA ( CENTRO );OTROS ROBOS;AREAS DE ACCESO PUBLICO;NO APLICA;OTROS;S.D.;LUNES;9;DOMINGO;5; -   -   - ; - USD.;FUERO ORDINARIO;S.D.;S.D.;1;2;0;[];0;0;0;0;0;0;1;0;0;1;NO;NO;NO;ACTIVO;OTROS ROBOS;OTROS ROBOS;SIN INFORMACION;OTROS ROBOS;OTROS ROBOS;OTROS ROBOS;NUEVO;13;1313;131301;EXTERNO;MANABI;SANTA ANA;UNICA - SANTA ANA;UNICA - SANTA ANA;ZAMBRANO AVEIGA CARLA VIVIANA;FISCALIA DE PATRIMONIO CIUDADANO;1801957034;CASTILLO GILER LUIS JACINTO;FISCALIA DE PATRIMONIO CIUDADANO 1;1,31302E+14;1,59945E+12;1,58969E+12;2020;2020;ROBO;NO FLAGRANTE;INVESTIGACION PREVIA;1,59945E+12;1,66253E+12;-936;CONSUMADO;INVESTIGACION PREVIA;1,59945E+12;ACTIVA;DENUNCIA FORMAL - ESCRITA;SN;CON ESTADO;3595;COIP;II - Delitos Contra los Derechos de Libertad;189;S.D.;2 ANIO;8 MESES;90 DIAS;45 DIAS;ROBO;Origen Desconocido;VERSIONES FISCALIA;1,59945E+12;1,59945E+12;2020;9;9:02:39;14:40:00;TARDE;9:02:39;-1.20695,-80.37144;MANABI;SANTA ANA;"SANTA ANA ; VIA SANTA ANA";SANTA ANA;URBANO;SANTA ANA ( CENTRO );OTROS ROBOS;AREAS DE ACCESO PUBLICO;NO APLICA;OTROS;S.D.;LUNES;9;DOMINGO;5;-   -   -;#¿NOMBRE?;FUERO ORDINARIO;S.D.;S.D.;1;2;0;[];0;0;0;0;0;0;1;0;0;1;NO;NO;NO;ACTIVO;OTROS ROBOS;OTROS ROBOS;SIN INFORMACION;OTROS ROBOS;OTROS ROBOS;OTROS ROBOS;NUEVO;13;1313;131301;EXTERNO;S.D.;S.D.;S.D.;S.D.;S.D.;S.D.;S.D.;S.D.;S.D.;S.D.;S.D.;S.D.;S.D.;S.D.;S.D.;S.D.;S.D.;S.D.;S.D.;S.D.;S.D.;S.D.;S.D.;S.D.;S.D.;S.D.;S.D.;S.D.;S.D.;S.D.;S.D.;S.D.;S.D.;S.D.;S.D.;S.D.;S.D.;S.D.;S.D.;S.D.;S.D.;S.D.;S.D.;S.D.;S.D.;S.D.;S.D.;S.D.;S.D.;S.D.;S.D.;S.D.;S.D.;S.D.;S.D.;S.D.;S.D.;S.D.;S.D.;S.D.;S.D.;S.D.;S.D.;S.D.;S.D.;S.D.;S.D.;S.D.;S.D.;S.D.;S.D.;S.D.;S.D.;S.D.;S.D.;S.D.;S.D.;S.D.;S.D.;S.D.
IMBABURA;SAN MIGUEL DE URCUQUI;UNICA - SAN MIGUEL DE URCUQUI;UNICA - SAN MIGUEL DE URCUQUI;FALCON GORDILLO MARIA JOSE;FISCALIA DE PATRIMONIO CIUDADANO;1003635347;ANDRADE CASTILLO JESSICA PATRICIA ;FISCALIA DE PATRIMONIO CIUDADANO 1;1,00602E+14;18/11/2024;12/11/2024;2024;2024;APROPIACIÓN FRAUDULENTA POR MEDIOS ELECTRÓNICOS;NO FLAGRANTE;INVESTIGACION PREVIA;18/11/2024;18/11/2025;232;CONSUMADO;INVESTIGACION PREVIA;18/11/2024 0:00;ACTIVA;DENUNCIA FORMAL - ORAL;SN;CON ESTADO;3062;COIP;II - Delitos Contra los Derechos de Libertad;190;S.D.;1 ANIO;4 MESES;90 DIAS;45 DIAS;APROPIACIÓN FRAUDULENTA POR MEDIOS ELECTRÓNICOS;Origen Desconocido;DELEGACIÓN AL AGENTE INVESTIGADOR(22) ;05/12/2024;18/11/2024;2024;11;12:32:08;15:00:00;TARDE;12:32:08;-78.15765,-78.15765;IMBABURA;SAN MIGUEL DE URCUQUI;"URCUQUI (P) ; ANTONIO ANTE";URCUQUI;URBANO;BARRIO CENTRAL;NO_APLICA;NO APLICA;NO APLICA;NO APLICA;S.D.;LUNES;11;MARTES;11; -   -   - ; - USD.;FUERO ORDINARIO;S.D.;S.D.;2;4;0;[];0;1;0;0;0;1;1;0;0;1;NO;NO;NO;ACTIVO;S.D.;S.D.;S.D.;S.D.;S.D.;S.D.;S.D.;10;1006;100656;EXTERNO;IMBABURA;SAN MIGUEL DE URCUQUI;UNICA - SAN MIGUEL DE URCUQUI;UNICA - SAN MIGUEL DE URCUQUI;FALCON GORDILLO MARIA JOSE;FISCALIA DE PATRIMONIO CIUDADANO;1003635347;ANDRADE CASTILLO JESSICA PATRICIA;FISCALIA DE PATRIMONIO CIUDADANO 1;1,00602E+14;1,73191E+12;1,73139E+12;2024;2024;APROPIACIÓN FRAUDULENTA POR MEDIOS ELECTRÓNICOS;NO FLAGRANTE;INVESTIGACION PREVIA;1,73191E+12;1,76344E+12;232;CONSUMADO;INVESTIGACION PREVIA;1,73191E+12;ACTIVA;DENUNCIA FORMAL - ORAL;SN;CON ESTADO;3062;COIP;II - Delitos Contra los Derechos de Libertad;190;S.D.;1 ANIO;4 MESES;90 DIAS;45 DIAS;APROPIACIÓN FRAUDULENTA POR MEDIOS ELECTRÓNICOS;Origen Desconocido;DELEGACIÓN AL AGENTE INVESTIGADOR(22);1,73337E+12;1,73191E+12;2024;11;12:32:08;15:00:00;TARDE;12:32:08;-78.15765,-78.15765;IMBABURA;SAN MIGUEL DE URCUQUI;"URCUQUI (P) ; ANTONIO ANTE";URCUQUI;URBANO;BARRIO CENTRAL;NO_APLICA;NO APLICA;NO APLICA;NO APLICA;S.D.;LUNES;11;MARTES;11;-   -   -;#¿NOMBRE?;FUERO ORDINARIO;S.D.;S.D.;2;4;0;[];0;1;0;0;0;1;1;0;0;1;NO;NO;NO;ACTIVO;S.D.;S.D.;S.D.;S.D.;S.D.;S.D.;S.D.;10;1006;100656;EXTERNO;S.D.;S.D.;S.D.;S.D.;S.D.;S.D.;S.D.;S.D.;S.D.;S.D.;S.D.;S.D.;S.D.;S.D.;S.D.;S.D.;S.D.;S.D.;S.D.;S.D.;S.D.;S.D.;S.D.;S.D.;S.D.;S.D.;S.D.;S.D.;S.D.;S.D.;S.D.;S.D.;S.D.;S.D.;S.D.;S.D.;S.D.;S.D.;S.D.;S.D.;S.D.;S.D.;S.D.;S.D.;S.D.;S.D.;S.D.;S.D.;S.D.;S.D.;S.D.;S.D.;S.D.;S.D.;S.D.;S.D.;S.D.;S.D.;S.D.;S.D.;S.D.;S.D.;S.D.;S.D.;S.D.;S.D.;S.D.;S.D.;S.D.;S.D.;S.D.;S.D.;S.D.;S.D.;S.D.;S.D.;S.D.;S.D.;S.D.;S.D.
EL ORO;ARENILLAS;UNICA - ARENILLAS;UNICA -  PORTOVELO;JARAMILLO SANGURIMA JOSE LUIS;FISCALIA DE PATRIMONIO CIUDADANO;702678376;MOROCHO ROSALES EDGAR BENIGNO ;FISCALIA DE PATRIMONIO CIUDADANO 1;7,02018E+13;20/03/2023;19/03/2023;2023;2023;ROBO;NO FLAGRANTE;INVESTIGACION PREVIA;20/03/2023;19/03/2025;-12;CONSUMADO;ARCHIVO SOLICITADO;12/04/2024 15:53;ACTIVA;DENUNCIA FORMAL - ORAL;SN;CON ESTADO;3595;COIP;II - Delitos Contra los Derechos de Libertad;189;S.D.;2 ANIO;8 MESES;90 DIAS;45 DIAS;ROBO;Origen Desconocido;SOLICITUD DE ARCHIVO;12/04/2024;20/03/2023;2023;3;9:29:07;10:00:00;MAÑANA;9:29:07;-3.55701,-80.07183;EL ORO;ARENILLAS;"ESCUELA CIUDAD DE ARENILLAS ; VIA SAN ANTONIO POR LA FINCA DE JHON CHERREZ";ARENILLAS;URBANO;CDLA. LAS COLINAS;ROBO DE MOTOS;AREAS DE ACCESO PUBLICO;ASALTO;ARMA DE FUEGO;Parque;LUNES;3;DOMINGO;3;MOTOCICLETA  -  JA402E  -  NEGRO  -   ROBADO ; - USD.;FUERO ORDINARIO;12/04/2024;RECHAZADO;2;4;0;[];0;1;0;0;0;1;0;0;0;1;NO;NO;NO;PASIVO;ROBO DE MOTOS;ROBO DE MOTOS;S.D.;ROBO DE MOTOS;ROBO DE MOTOS;ROBO DE MOTOS;MODELO;7;702;70256;EXTERNO;EL ORO;ARENILLAS;UNICA - ARENILLAS;UNICA -  PORTOVELO;JARAMILLO SANGURIMA JOSE LUIS;FISCALIA DE PATRIMONIO CIUDADANO;702678376;MOROCHO ROSALES EDGAR BENIGNO;FISCALIA DE PATRIMONIO CIUDADANO 1;7,02018E+13;1,67929E+12;1,6792E+12;2023;2023;ROBO;NO FLAGRANTE;INVESTIGACION PREVIA;1,67929E+12;1,74236E+12;-12;CONSUMADO;ARCHIVO SOLICITADO;1,7129E+12;ACTIVA;DENUNCIA FORMAL - ORAL;SN;CON ESTADO;3595;COIP;II - Delitos Contra los Derechos de Libertad;189;S.D.;2 ANIO;8 MESES;90 DIAS;45 DIAS;ROBO;Origen Desconocido;SOLICITUD DE ARCHIVO;1,7129E+12;1,67929E+12;2023;3;9:29:07;10:00:00;MAÑANA;9:29:07;-3.55701,-80.07183;EL ORO;ARENILLAS;"ESCUELA CIUDAD DE ARENILLAS ; VIA SAN ANTONIO POR LA FINCA DE JHON CHERREZ";ARENILLAS;URBANO;CDLA. LAS COLINAS;ROBO DE MOTOS;AREAS DE ACCESO PUBLICO;ASALTO;ARMA DE FUEGO;Parque;LUNES;3;DOMINGO;3;MOTOCICLETA  -  JA402E  -  NEGRO  -   ROBADO;#¿NOMBRE?;FUERO ORDINARIO;12/04/2024;RECHAZADO;2;4;0;[];0;1;0;0;0;1;0;0;0;1;NO;NO;NO;PASIVO;ROBO DE MOTOS;ROBO DE MOTOS;S.D.;ROBO DE MOTOS;ROBO DE MOTOS;ROBO DE MOTOS;MODELO;7;702;70256;EXTERNO;S.D.;S.D.;S.D.;S.D.;S.D.;S.D.;S.D.;S.D.;S.D.;S.D.;S.D.;S.D.;S.D.;S.D.;S.D.;S.D.;S.D.;S.D.;S.D.;S.D.;S.D.;S.D.;S.D.;S.D.;S.D.;S.D.;S.D.;S.D.;S.D.;S.D.;S.D.;S.D.;S.D.;S.D.;S.D.;S.D.;S.D.;S.D.;S.D.;S.D.;S.D.;S.D.;S.D.;S.D.;S.D.;S.D.;S.D.;S.D.;S.D.;S.D.;S.D.;S.D.;S.D.;S.D.;S.D.;S.D.;S.D.;S.D.;S.D.;S.D.;S.D.;S.D.;S.D.;S.D.;S.D.;S.D.;S.D.;S.D.;S.D.;S.D.;S.D.;S.D.;S.D.;S.D.;S.D.;S.D.;S.D.;S.D.;S.D.;S.D.
