PICHINCHA;QUITO;CASA DE LA JUSTICIA;CASA DE LA JUSTICIA;TORRES FARINANGO FRANCISCO RUBEN;FISCALIA DE SOLUCIONES RAPIDAS;1722549423;FLORES FLORES ARACELY NATALY ;FISCALIA DE SOLUCIONES RAPIDAS 4;1,70102E+14;04/10/2023;29/09/2023;2023;2023;INTIMIDACIÓN;NO FLAGRANTE;INVESTIGACION PREVIA;23/10/2023;22/10/2024;-160;CONSUMADO;INVESTIGACION PREVIA;23/10/2023 0:00;ACTIVA;DENUNCIA FORMAL - ORAL;SN;CON ESTADO;4644;COIP;II - Delitos Contra los Derechos de Libertad;154;S.D.;1 ANIO;4 MESES;90 DIAS;45 DIAS;INTIMIDACIÓN;Origen Desconocido;DELEGACIÓN AL AGENTE INVESTIGADOR(22) ;23/10/2023;04/10/2023;2023;10;12:48:02;11:00:00;MAÑANA;12:48:02;-0.04848,-78.45985;PICHINCHA;QUITO;"POMASQUI (P) ; CALLE PEREZ REINA CONJUNTO GRANILANDIA";POMASQUI;RURAL;GRANILANDIA LATO;NO_APLICA;NO APLICA;NO APLICA;NO APLICA;S.D.;MIERCOLES;10;VIERNES;9; -   -   - ; - USD.;FUERO ORDINARIO;S.D.;S.D.;1;2;0;[];0;0;0;0;0;0;1;0;0;1;NO;NO;NO;ACTIVO;S.D.;S.D.;S.D.;S.D.;S.D.;S.D.;S.D.;17;1701;170177;EXTERNO;PICHINCHA;QUITO;CASA DE LA JUSTICIA;CASA DE LA JUSTICIA;TORRES FARINANGO FRANCISCO RUBEN;FISCALIA DE SOLUCIONES RAPIDAS;1722549423;FLORES FLORES ARACELY NATALY;FISCALIA DE SOLUCIONES RAPIDAS 4;1,70102E+14;1,6964E+12;1,69596E+12;2023;2023;INTIMIDACIÓN;NO FLAGRANTE;INVESTIGACION PREVIA;1,69804E+12;1,72957E+12;-160;CONSUMADO;INVESTIGACION PREVIA;1,69804E+12;ACTIVA;DENUNCIA FORMAL - ORAL;SN;CON ESTADO;4644;COIP;II - Delitos Contra los Derechos de Libertad;154;S.D.;1 ANIO;4 MESES;90 DIAS;45 DIAS;INTIMIDACIÓN;Origen Desconocido;DELEGACIÓN AL AGENTE INVESTIGADOR(22);1,69804E+12;1,6964E+12;2023;10;12:48:02;11:00:00;MAÑANA;12:48:02;-0.04848,-78.45985;PICHINCHA;QUITO;"POMASQUI (P) ; CALLE PEREZ REINA CONJUNTO GRANILANDIA";POMASQUI;RURAL;GRANILANDIA LATO;NO_APLICA;NO APLICA;NO APLICA;NO APLICA;S.D.;MIERCOLES;10;VIERNES;9;-   -   -;#¿NOMBRE?;FUERO ORDINARIO;S.D.;S.D.;1;2;0;[];0;0;0;0;0;0;1;0;0;1;NO;NO;NO;ACTIVO;S.D.;S.D.;S.D.;S.D.;S.D.;S.D.;S.D.;17;1701;170177;EXTERNO;S.D.;S.D.;S.D.;S.D.;S.D.;S.D.;S.D.;S.D.;S.D.;S.D.;S.D.;S.D.;S.D.;S.D.;S.D.;S.D.;S.D.;S.D.;S.D.;S.D.;S.D.;S.D.;S.D.;S.D.;S.D.;S.D.;S.D.;S.D.;S.D.;S.D.;S.D.;S.D.;S.D.;S.D.;S.D.;S.D.;S.D.;S.D.;S.D.;S.D.;S.D.;S.D.;S.D.;S.D.;S.D.;S.D.;S.D.;S.D.;S.D.;S.D.;S.D.;S.D.;S.D.;S.D.;S.D.;S.D.;S.D.;S.D.;S.D.;S.D.;S.D.;S.D.;S.D.;S.D.;S.D.;S.D.;S.D.;S.D.;S.D.;S.D.;S.D.;S.D.;S.D.;S.D.;S.D.;S.D.;S.D.;S.D.;S.D.;S.D.
ORELLANA;PUERTO FRANCISCO DE ORELLANA;UNICA - ORELLANA;UNICA - ORELLANA;CORDONES GUALAN DANNY ROBERTO;FISCALIA DE VIOLENCIA DE GENERO;1102142393;PALACIOS SOTOMAYOR PIO AGUSTIN ;FISCALIA DE VIOLENCIA DE GENERO 3;2,20102E+14;12/09/2016;10/09/2016;2016;2016;VIOLACIÓN;FLAGRANTE;INVESTIGACION PREVIA;14/09/2016;14/09/2018;-2390;TENTATIVA;ARCHIVO ACEPTADO;05/10/2022 0:00;ARCHIVADA POR ACEPTACION DE SOLICITUD;PARTE POLICIAL;PJUCP22019991;CON ESTADO;3714;COIP;II - Delitos Contra los Derechos de Libertad;171;S.D.;2 ANIO;8 MESES;90 DIAS;45 DIAS;VIOLACIÓN;Origen Desconocido;SOLICITUD DE ARCHIVO;22/06/2022;12/09/2016;2016;9;16:50:24;21:00:00;NOCHE;16:50:24;-0.54335,-76.78206;ORELLANA;PUERTO FRANCISCO DE ORELLANA;"TARACOA (NUEVA ESPERANZA  YUCA) (P) ; AV AMAZONAS Y CALLE LOJA";TARACOA (CAB. EN NUEVA ESPERANZA: YUCA);RURAL;TARACOA;NO_APLICA;NO APLICA;NO APLICA;NO APLICA;S.D.;LUNES;9;SABADO;9; -   -   - ; - USD.;FUERO ORDINARIO;14/10/2022;RECHAZADO;3;12;0;[];0;1;0;0;0;1;1;0;0;1;SI;SI;NO;PASIVO;S.D.;S.D.;S.D.;S.D.;S.D.;S.D.;S.D.;22;2201;220152;EXTERNO;ORELLANA;PUERTO FRANCISCO DE ORELLANA;UNICA - ORELLANA;UNICA - ORELLANA;CORDONES GUALAN DANNY ROBERTO;FISCALIA DE VIOLENCIA DE GENERO;1102142393;PALACIOS SOTOMAYOR PIO AGUSTIN;FISCALIA DE VIOLENCIA DE GENERO 3;2,20102E+14;1,47366E+12;1,47348E+12;2016;2016;VIOLACIÓN;FLAGRANTE;INVESTIGACION PREVIA;1,47383E+12;1,5369E+12;-2390;TENTATIVA;ARCHIVO ACEPTADO;1,66495E+12;ARCHIVADA POR ACEPTACION DE SOLICITUD;PARTE POLICIAL;PJUCP22019991;CON ESTADO;3714;COIP;II - Delitos Contra los Derechos de Libertad;171;S.D.;2 ANIO;8 MESES;90 DIAS;45 DIAS;VIOLACIÓN;Origen Desconocido;SOLICITUD DE ARCHIVO;1,65587E+12;1,47366E+12;2016;9;16:50:24;21:00:00;NOCHE;16:50:24;-0.54335,-76.78206;ORELLANA;PUERTO FRANCISCO DE ORELLANA;"TARACOA (NUEVA ESPERANZA  YUCA) (P) ; AV AMAZONAS Y CALLE LOJA";TARACOA (CAB. EN NUEVA ESPERANZA: YUCA);RURAL;TARACOA;NO_APLICA;NO APLICA;NO APLICA;NO APLICA;S.D.;LUNES;9;SABADO;9;-   -   -;#¿NOMBRE?;FUERO ORDINARIO;14/10/2022;RECHAZADO;3;12;0;[];0;1;0;0;0;1;1;0;0;1;SI;SI;NO;PASIVO;S.D.;S.D.;S.D.;S.D.;S.D.;S.D.;S.D.;22;2201;220152;EXTERNO;S.D.;S.D.;S.D.;S.D.;S.D.;S.D.;S.D.;S.D.;S.D.;S.D.;S.D.;S.D.;S.D.;S.D.;S.D.;S.D.;S.D.;S.D.;S.D.;S.D.;S.D.;S.D.;S.D.;S.D.;S.D.;S.D.;S.D.;S.D.;S.D.;S.D.;S.D.;S.D.;S.D.;S.D.;S.D.;S.D.;S.D.;S.D.;S.D.;S.D.;S.D.;S.D.;S.D.;S.D.;S.D.;S.D.;S.D.;S.D.;S.D.;S.D.;S.D.;S.D.;S.D.;S.D.;S.D.;S.D.;S.D.;S.D.;S.D.;S.D.;S.D.;S.D.;S.D.;S.D.;S.D.;S.D.;S.D.;S.D.;S.D.;S.D.;S.D.;S.D.;S.D.;S.D.;S.D.;S.D.;S.D.;S.D.;S.D.;S.D.
AZUAY;CUENCA;EDIFICIO CENTRAL CUENCA;PAUCARBAMBA;IDROVO MOSQUERA SUSANA VALERIA;FISCALIA DE PATRIMONIO CIUDADANO;703414219;LEDESMA ROMERO MARIA ALEJANDRA ;FISCALIA DE PATRIMONIO CIUDADANO 2;1,01018E+13;25/01/2016;23/01/2016;2016;2016;ROBO;NO FLAGRANTE;INVESTIGACION PREVIA;01/02/2016;31/01/2018;-2616;CONSUMADO;ARCHIVO ACEPTADO;12/02/2019 0:00;ARCHIVADA POR ACEPTACION DE SOLICITUD;DENUNCIA FORMAL - ORAL;SN;CON ESTADO;3595;COIP;II - Delitos Contra los Derechos de Libertad;189;S.D.;2 ANIO;8 MESES;90 DIAS;45 DIAS;ROBO;Origen Desconocido;SOLICITUD DE ARCHIVO;16/01/2019;25/01/2016;2016;1;12:10:01;1:30:00;MADRUGADA;12:10:01;-2.9110069,-79.0083769;AZUAY;CUENCA;AV 10 DE AGOSTO Y AV  FRAY VICENTE SOLANO;HUAYNACAPAC;URBANO;MAMA PIO;ROBO A PERSONAS;AREAS DE ACCESO PUBLICO;ASALTO;ARMA DE FUEGO;Parque;LUNES;1;SABADO;1; -   -   - ;DOCUMENTOS PERSONALES  - USD. 90.00 250.00;FUERO ORDINARIO;04/06/2019;RECHAZADO;1;2;0;[];0;1;0;0;0;1;1;0;0;1;NO;NO;NO;PASIVO;ROBO A PERSONAS;ROBO A PERSONAS;ROBO A PERSONAS;ROBO A PERSONAS;ROBO A PERSONAS;ROBO A PERSONAS;MODELO;1;101;10107;EXTERNO;AZUAY;CUENCA;EDIFICIO CENTRAL CUENCA;PAUCARBAMBA;IDROVO MOSQUERA SUSANA VALERIA;FISCALIA DE PATRIMONIO CIUDADANO;703414219;LEDESMA ROMERO MARIA ALEJANDRA;FISCALIA DE PATRIMONIO CIUDADANO 2;1,01018E+13;1,4537E+12;1,45353E+12;2016;2016;ROBO;NO FLAGRANTE;INVESTIGACION PREVIA;1,4543E+12;1,51737E+12;-2616;CONSUMADO;ARCHIVO ACEPTADO;1,54995E+12;ARCHIVADA POR ACEPTACION DE SOLICITUD;DENUNCIA FORMAL - ORAL;SN;CON ESTADO;3595;COIP;II - Delitos Contra los Derechos de Libertad;189;S.D.;2 ANIO;8 MESES;90 DIAS;45 DIAS;ROBO;Origen Desconocido;SOLICITUD DE ARCHIVO;1,54761E+12;1,4537E+12;2016;1;12:10:01;1:30:00;MADRUGADA;12:10:01;-2.9110069,-79.0083769;AZUAY;CUENCA;AV 10 DE AGOSTO Y AV  FRAY VICENTE SOLANO;HUAYNACAPAC;URBANO;MAMA PIO;ROBO A PERSONAS;AREAS DE ACCESO PUBLICO;ASALTO;ARMA DE FUEGO;Parque;LUNES;1;SABADO;1;-   -   -;DOCUMENTOS PERSONALES  - USD. 90.00 250.00;FUERO ORDINARIO;04/06/2019;RECHAZADO;1;2;0;[];0;1;0;0;0;1;1;0;0;1;NO;NO;NO;PASIVO;ROBO A PERSONAS;ROBO A PERSONAS;ROBO A PERSONAS;ROBO A PERSONAS;ROBO A PERSONAS;ROBO A PERSONAS;MODELO;1;101;10107;EXTERNO;S.D.;S.D.;S.D.;S.D.;S.D.;S.D.;S.D.;S.D.;S.D.;S.D.;S.D.;S.D.;S.D.;S.D.;S.D.;S.D.;S.D.;S.D.;S.D.;S.D.;S.D.;S.D.;S.D.;S.D.;S.D.;S.D.;S.D.;S.D.;S.D.;S.D.;S.D.;S.D.;S.D.;S.D.;S.D.;S.D.;S.D.;S.D.;S.D.;S.D.;S.D.;S.D.;S.D.;S.D.;S.D.;S.D.;S.D.;S.D.;S.D.;S.D.;S.D.;S.D.;S.D.;S.D.;S.D.;S.D.;S.D.;S.D.;S.D.;S.D.;S.D.;S.D.;S.D.;S.D.;S.D.;S.D.;S.D.;S.D.;S.D.;S.D.;S.D.;S.D.;S.D.;S.D.;S.D.;S.D.;S.D.;S.D.;S.D.;S.D.
GUAYAS;GUAYAQUIL;FISCALIA DEL SUR;UNIDAD JUDICIAL DE FLAGRANCIA – UVC CUARTEL MODELO;CABRERA RENNELLA ALEJANDRO NATHAN;FISCALIA DE SOLUCIONES RAPIDAS;911329159;ACURIO QUEZADA KATIA ALEXANDRA ;FISCALIA DE SOLUCIONES RAPIDAS 3;9,01018E+13;14/02/2020;14/02/2020;2020;2020;INTIMIDACIÓN;NO FLAGRANTE;INVESTIGACION PREVIA;21/02/2020;20/02/2021;-1500;CONSUMADO;ARCHIVO SOLICITADO;27/12/2024 14:14;ACTIVA;DENUNCIA FORMAL - ORAL;SN;CON ESTADO;3422;COIP;II - Delitos Contra los Derechos de Libertad;154;S.D.;1 ANIO;4 MESES;90 DIAS;45 DIAS;INTIMIDACIÓN;Origen Desconocido;SOLICITUD DE ARCHIVO;27/12/2024;14/02/2020;2020;2;15:03:41;11:00:00;MAÑANA;15:03:41;-2.2746,-79.88309;GUAYAS;GUAYAQUIL;"GUASMO ESTE ; MI LUGAR DE TRABAJO  UBICADO EN EL SECTOR DE LA PLAYITA DEL GUASMO SUR";XIMENA;URBANO;XIMENA;NO_APLICA;NO APLICA;NO APLICA;NO APLICA;Trabajo;VIERNES;2;VIERNES;2; -   -   - ; - USD.;FUERO ORDINARIO;27/12/2024;RECHAZADO;3;9;0;[];0;4;0;0;0;4;1;0;0;1;NO;NO;NO;PASIVO;S.D.;S.D.;S.D.;S.D.;S.D.;S.D.;S.D.;9;901;90114;EXTERNO;GUAYAS;GUAYAQUIL;FISCALIA DEL SUR;UNIDAD JUDICIAL DE FLAGRANCIA – UVC CUARTEL MODELO;CABRERA RENNELLA ALEJANDRO NATHAN;FISCALIA DE SOLUCIONES RAPIDAS;911329159;ACURIO QUEZADA KATIA ALEXANDRA;FISCALIA DE SOLUCIONES RAPIDAS 3;9,01018E+13;1,58166E+12;1,58166E+12;2020;2020;INTIMIDACIÓN;NO FLAGRANTE;INVESTIGACION PREVIA;1,58226E+12;1,6138E+12;-1500;CONSUMADO;ARCHIVO SOLICITADO;1,73528E+12;ACTIVA;DENUNCIA FORMAL - ORAL;SN;CON ESTADO;3422;COIP;II - Delitos Contra los Derechos de Libertad;154;S.D.;1 ANIO;4 MESES;90 DIAS;45 DIAS;INTIMIDACIÓN;Origen Desconocido;SOLICITUD DE ARCHIVO;1,73528E+12;1,58166E+12;2020;2;15:03:41;11:00:00;MAÑANA;15:03:41;-2.2746,-79.88309;GUAYAS;GUAYAQUIL;"GUASMO ESTE ; MI LUGAR DE TRABAJO  UBICADO EN EL SECTOR DE LA PLAYITA DEL GUASMO SUR";XIMENA;URBANO;XIMENA;NO_APLICA;NO APLICA;NO APLICA;NO APLICA;Trabajo;VIERNES;2;VIERNES;2;-   -   -;#¿NOMBRE?;FUERO ORDINARIO;27/12/2024;RECHAZADO;3;9;0;[];0;4;0;0;0;4;1;0;0;1;NO;NO;NO;PASIVO;S.D.;S.D.;S.D.;S.D.;S.D.;S.D.;S.D.;9;901;90114;EXTERNO;S.D.;S.D.;S.D.;S.D.;S.D.;S.D.;S.D.;S.D.;S.D.;S.D.;S.D.;S.D.;S.D.;S.D.;S.D.;S.D.;S.D.;S.D.;S.D.;S.D.;S.D.;S.D.;S.D.;S.D.;S.D.;S.D.;S.D.;S.D.;S.D.;S.D.;S.D.;S.D.;S.D.;S.D.;S.D.;S.D.;S.D.;S.D.;S.D.;S.D.;S.D.;S.D.;S.D.;S.D.;S.D.;S.D.;S.D.;S.D.;S.D.;S.D.;S.D.;S.D.;S.D.;S.D.;S.D.;S.D.;S.D.;S.D.;S.D.;S.D.;S.D.;S.D.;S.D.;S.D.;S.D.;S.D.;S.D.;S.D.;S.D.;S.D.;S.D.;S.D.;S.D.;S.D.;S.D.;S.D.;S.D.;S.D.;S.D.;S.D.
GUAYAS;GUAYAQUIL;EDIFICIO MONTECRISTI - GYE;UNIDAD JUDICIAL DE FLAGRANCIA – UVC CUARTEL MODELO;MENOSCAL  MORA  MARÍA AUCILIADORA;FISCALIA DE PATRIMONIO CIUDADANO;602631475;ESCOBAR ARRIETA MARCO VINICIO ;FISCALIA DE PATRIMONIO CIUDADANO 5;9,01018E+13;19/08/2020;19/08/2020;2020;2020;ROBO;NO FLAGRANTE;INVESTIGACION PREVIA;26/08/2020;26/08/2022;-948;CONSUMADO;ARCHIVO SOLICITADO;07/06/2024 5:37;ACTIVA;DENUNCIA FORMAL - ORAL;SN;CON ESTADO;3595;COIP;II - Delitos Contra los Derechos de Libertad;189;S.D.;2 ANIO;8 MESES;90 DIAS;45 DIAS;ROBO;Origen Desconocido;SOLICITUD DE ARCHIVO;07/06/2024;19/08/2020;2020;8;10:33:11;7:50:00;MAÑANA;10:38:16;-2.09702,-79.92554;GUAYAS;GUAYAQUIL;"BASTION POPULAR ; FLOR DE BASTIÓN BLOQUE 15";TARQUI NORTE;URBANO;BASTION POPULAR;ROBO DE MOTOS;AREAS DE ACCESO PUBLICO;ASALTO;ARMA DE FUEGO;Parque;MIERCOLES;8;MIERCOLES;8;AUTOMOTOR  -  IA084H  -  SC  -   S.D. ; - USD.;FUERO ORDINARIO;07/06/2024;RECHAZADO;3;8;0;[];0;1;0;0;0;1;0;0;0;1;NO;NO;NO;PASIVO;ROBO DE MOTOS;ROBO DE MOTOS;ROBO DE MOTOS;ROBO DE MOTOS;ROBO DE MOTOS;ROBO DE MOTOS;MODELO;9;901;90112;EXTERNO;GUAYAS;GUAYAQUIL;EDIFICIO MONTECRISTI - GYE;UNIDAD JUDICIAL DE FLAGRANCIA – UVC CUARTEL MODELO;MENOSCAL  MORA  MARÍA AUCILIADORA;FISCALIA DE PATRIMONIO CIUDADANO;602631475;ESCOBAR ARRIETA MARCO VINICIO;FISCALIA DE PATRIMONIO CIUDADANO 5;9,01018E+13;1,59781E+12;1,59781E+12;2020;2020;ROBO;NO FLAGRANTE;INVESTIGACION PREVIA;1,59842E+12;1,66149E+12;-948;CONSUMADO;ARCHIVO SOLICITADO;1,71774E+12;ACTIVA;DENUNCIA FORMAL - ORAL;SN;CON ESTADO;3595;COIP;II - Delitos Contra los Derechos de Libertad;189;S.D.;2 ANIO;8 MESES;90 DIAS;45 DIAS;ROBO;Origen Desconocido;SOLICITUD DE ARCHIVO;1,71774E+12;1,59781E+12;2020;8;10:33:11;7:50:00;MAÑANA;10:38:16;-2.09702,-79.92554;GUAYAS;GUAYAQUIL;"BASTION POPULAR ; FLOR DE BASTIÓN BLOQUE 15";TARQUI NORTE;URBANO;BASTION POPULAR;ROBO DE MOTOS;AREAS DE ACCESO PUBLICO;ASALTO;ARMA DE FUEGO;Parque;MIERCOLES;8;MIERCOLES;8;AUTOMOTOR  -  IA084H  -  SC  -   S.D.;#¿NOMBRE?;FUERO ORDINARIO;07/06/2024;RECHAZADO;3;8;0;[];0;1;0;0;0;1;0;0;0;1;NO;NO;NO;PASIVO;ROBO DE MOTOS;ROBO DE MOTOS;ROBO DE MOTOS;ROBO DE MOTOS;ROBO DE MOTOS;ROBO DE MOTOS;MODELO;9;901;90112;EXTERNO;S.D.;S.D.;S.D.;S.D.;S.D.;S.D.;S.D.;S.D.;S.D.;S.D.;S.D.;S.D.;S.D.;S.D.;S.D.;S.D.;S.D.;S.D.;S.D.;S.D.;S.D.;S.D.;S.D.;S.D.;S.D.;S.D.;S.D.;S.D.;S.D.;S.D.;S.D.;S.D.;S.D.;S.D.;S.D.;S.D.;S.D.;S.D.;S.D.;S.D.;S.D.;S.D.;S.D.;S.D.;S.D.;S.D.;S.D.;S.D.;S.D.;S.D.;S.D.;S.D.;S.D.;S.D.;S.D.;S.D.;S.D.;S.D.;S.D.;S.D.;S.D.;S.D.;S.D.;S.D.;S.D.;S.D.;S.D.;S.D.;S.D.;S.D.;S.D.;S.D.;S.D.;S.D.;S.D.;S.D.;S.D.;S.D.;S.D.;S.D.
GUAYAS;MILAGRO;UNICA - MILAGRO;UNICA - MILAGRO;MALDONADO DE LUCA ISRAEL ANTONIO;FISCALIA DE PATRIMONIO CIUDADANO;603191453;RAMOS ECHEVERRIA MIGUEL ANGEL ;FISCALIA DE PATRIMONIO CIUDADANO 5;9,10018E+13;01/05/2018;30/04/2018;2018;2018;ROBO;NO FLAGRANTE;INVESTIGACION PREVIA;14/05/2018;13/05/2020;-1783;CONSUMADO;ARCHIVO SOLICITADO;23/07/2021 9:02;ACTIVA;DENUNCIA FORMAL - ORAL;SN;CON ESTADO;3595;COIP;II - Delitos Contra los Derechos de Libertad;189;S.D.;2 ANIO;8 MESES;90 DIAS;45 DIAS;ROBO;Origen Desconocido;SOLICITUD DE ARCHIVO;23/07/2021;01/05/2018;2018;5;15:23:23;21:30:00;NOCHE;15:23:23;-2.10294,-79.57827;GUAYAS;MILAGRO;"MILAGRO (P) ; MANUEL DE J CALLE Y RIO QUINDES";MILAGRO;URBANO;CHIRIJOS;ROBO A PERSONAS;AREAS DE ACCESO PUBLICO;ASALTO;ARMA DE FUEGO;Parque;MARTES;5;LUNES;4; -   -   - ; - USD.;FUERO ORDINARIO;26/05/2020;RECHAZADO;1;2;0;[];0;1;0;0;0;1;1;0;0;1;NO;NO;NO;PASIVO;ROBO A PERSONAS;ROBO A PERSONAS;ROBO A PERSONAS;ROBO A PERSONAS;ROBO A PERSONAS;ROBO A PERSONAS;MODELO;9;910;91050;EXTERNO;GUAYAS;MILAGRO;UNICA - MILAGRO;UNICA - MILAGRO;MALDONADO DE LUCA ISRAEL ANTONIO;FISCALIA DE PATRIMONIO CIUDADANO;603191453;RAMOS ECHEVERRIA MIGUEL ANGEL;FISCALIA DE PATRIMONIO CIUDADANO 5;9,10018E+13;1,52515E+12;1,52506E+12;2018;2018;ROBO;NO FLAGRANTE;INVESTIGACION PREVIA;1,52627E+12;1,58935E+12;-1783;CONSUMADO;ARCHIVO SOLICITADO;1,62702E+12;ACTIVA;DENUNCIA FORMAL - ORAL;SN;CON ESTADO;3595;COIP;II - Delitos Contra los Derechos de Libertad;189;S.D.;2 ANIO;8 MESES;90 DIAS;45 DIAS;ROBO;Origen Desconocido;SOLICITUD DE ARCHIVO;1,62702E+12;1,52515E+12;2018;5;15:23:23;21:30:00;NOCHE;15:23:23;-2.10294,-79.57827;GUAYAS;MILAGRO;"MILAGRO (P) ; MANUEL DE J CALLE Y RIO QUINDES";MILAGRO;URBANO;CHIRIJOS;ROBO A PERSONAS;AREAS DE ACCESO PUBLICO;ASALTO;ARMA DE FUEGO;Parque;MARTES;5;LUNES;4;-   -   -;#¿NOMBRE?;FUERO ORDINARIO;26/05/2020;RECHAZADO;1;2;0;[];0;1;0;0;0;1;1;0;0;1;NO;NO;NO;PASIVO;ROBO A PERSONAS;ROBO A PERSONAS;ROBO A PERSONAS;ROBO A PERSONAS;ROBO A PERSONAS;ROBO A PERSONAS;MODELO;9;910;91050;EXTERNO;S.D.;S.D.;S.D.;S.D.;S.D.;S.D.;S.D.;S.D.;S.D.;S.D.;S.D.;S.D.;S.D.;S.D.;S.D.;S.D.;S.D.;S.D.;S.D.;S.D.;S.D.;S.D.;S.D.;S.D.;S.D.;S.D.;S.D.;S.D.;S.D.;S.D.;S.D.;S.D.;S.D.;S.D.;S.D.;S.D.;S.D.;S.D.;S.D.;S.D.;S.D.;S.D.;S.D.;S.D.;S.D.;S.D.;S.D.;S.D.;S.D.;S.D.;S.D.;S.D.;S.D.;S.D.;S.D.;S.D.;S.D.;S.D.;S.D.;S.D.;S.D.;S.D.;S.D.;S.D.;S.D.;S.D.;S.D.;S.D.;S.D.;S.D.;S.D.;S.D.;S.D.;S.D.;S.D.;S.D.;S.D.;S.D.;S.D.;S.D.
MORONA SANTIAGO;MORONA;UNICA - MORONA;UNICA - MORONA;REINOSO TORRES ANA JANETH;FISCALIA DE FE  PUBLICA;103641635;CAÑAR ROMERO JONATHAN ADRIAN ;FISCALIA DE FE  PUBLICA 4;1,40702E+14;13/03/2024;09/03/2024;2024;2024;FRAUDE PROCESAL;NO FLAGRANTE;INVESTIGACION PREVIA;14/03/2024;14/03/2025;-17;CONSUMADO;ARCHIVO ACEPTADO;01/09/2024 0:00;ARCHIVADA POR ACEPTACION DE SOLICITUD;DENUNCIA FORMAL - ESCRITA;SN;CON ESTADO;3367;COIP;V - Delitos Contra la Responsabilidad Ciudadana;272;S.D.;1 ANIO;4 MESES;90 DIAS;45 DIAS;FRAUDE PROCESAL;Origen Desconocido;SOLICITUD DE ARCHIVO;07/08/2024;13/03/2024;2024;3;14:33:19;11:30:00;MAÑANA;14:33:19;-1.91679,-77.91463;MORONA SANTIAGO;HUAMBOYA;"HUAMBOYA (P) ; VIA A PABLO SEXTO  SECTO EX GRANJA DEL CREA";HUAMBOYA;URBANO;BARRIO URBE NORTE;NO_APLICA;NO APLICA;NO APLICA;NO APLICA;S.D.;MIERCOLES;3;SABADO;3; -   -   - ; - USD.;FUERO ORDINARIO;03/10/2024;RECHAZADO;11;28;0;[];0;2;0;0;0;2;1;0;0;1;NO;NO;NO;PASIVO;S.D.;S.D.;S.D.;S.D.;S.D.;S.D.;S.D.;14;1407;140769;EXTERNO;MORONA SANTIAGO;MORONA;UNICA - MORONA;UNICA - MORONA;REINOSO TORRES ANA JANETH;FISCALIA DE FE  PUBLICA;103641635;CAÑAR ROMERO JONATHAN ADRIAN;FISCALIA DE FE  PUBLICA 4;1,40702E+14;1,71031E+12;1,70996E+12;2024;2024;FRAUDE PROCESAL;NO FLAGRANTE;INVESTIGACION PREVIA;1,71039E+12;1,74193E+12;-17;CONSUMADO;ARCHIVO ACEPTADO;1,72517E+12;ARCHIVADA POR ACEPTACION DE SOLICITUD;DENUNCIA FORMAL - ESCRITA;SN;CON ESTADO;3367;COIP;V - Delitos Contra la Responsabilidad Ciudadana;272;S.D.;1 ANIO;4 MESES;90 DIAS;45 DIAS;FRAUDE PROCESAL;Origen Desconocido;SOLICITUD DE ARCHIVO;1,72301E+12;1,71031E+12;2024;3;14:33:19;11:30:00;MAÑANA;14:33:19;-1.91679,-77.91463;MORONA SANTIAGO;HUAMBOYA;"HUAMBOYA (P) ; VIA A PABLO SEXTO  SECTO EX GRANJA DEL CREA";HUAMBOYA;URBANO;BARRIO URBE NORTE;NO_APLICA;NO APLICA;NO APLICA;NO APLICA;S.D.;MIERCOLES;3;SABADO;3;-   -   -;#¿NOMBRE?;FUERO ORDINARIO;03/10/2024;RECHAZADO;11;28;0;[];0;2;0;0;0;2;1;0;0;1;NO;NO;NO;PASIVO;S.D.;S.D.;S.D.;S.D.;S.D.;S.D.;S.D.;14;1407;140769;EXTERNO;S.D.;S.D.;S.D.;S.D.;S.D.;S.D.;S.D.;S.D.;S.D.;S.D.;S.D.;S.D.;S.D.;S.D.;S.D.;S.D.;S.D.;S.D.;S.D.;S.D.;S.D.;S.D.;S.D.;S.D.;S.D.;S.D.;S.D.;S.D.;S.D.;S.D.;S.D.;S.D.;S.D.;S.D.;S.D.;S.D.;S.D.;S.D.;S.D.;S.D.;S.D.;S.D.;S.D.;S.D.;S.D.;S.D.;S.D.;S.D.;S.D.;S.D.;S.D.;S.D.;S.D.;S.D.;S.D.;S.D.;S.D.;S.D.;S.D.;S.D.;S.D.;S.D.;S.D.;S.D.;S.D.;S.D.;S.D.;S.D.;S.D.;S.D.;S.D.;S.D.;S.D.;S.D.;S.D.;S.D.;S.D.;S.D.;S.D.;S.D.
PICHINCHA;QUITO;SUR - MENA;SUR - MENA;PILATAXI YUNGAN LUIS FABIAN;FISCALIA DE ACCIDENTES DE TRANSITO;1710572437;ASIMBAYA TACURI ELVIA SUSANA ;FISCALIA DE ACCIDENTES DE TRANSITO 3;1,70102E+14;23/08/2016;20/08/2016;2016;2016;DAÑOS MATERIALES;NO FLAGRANTE;INVESTIGACION PREVIA;24/08/2016;24/08/2017;-2776;CONSUMADO;ARCHIVO ACEPTADO;12/10/2016 0:00;ARCHIVADA POR ACEPTACION DE SOLICITUD;PARTE POLICIAL - TRANSITO - NO FLAGRANTE;AMT-2016-JQ-0613;CON ESTADO;3164;COIP;VIII - Infracciones de Tránsito;380;S.D.;1 ANIO;4 MESES;45 DIAS;45 DIAS;DAÑOS MATERIALES;Origen Desconocido;S.D.;S.D.;23/08/2016;2016;8;9:22:48;16:30:00;TARDE;9:22:48;-0.290326,-78.565485;PICHINCHA;QUITO;"JOAQUIN DARQUEA Y NICOLAS CEVALLOS ; CALLE A Y SEGUNDO DARQUEA";CHILLOGALLO;URBANO;CHILLOGALLO;NO_APLICA;NO APLICA;NO APLICA;NO APLICA;Parque;MARTES;8;SABADO;8;AUTOMOTOR  -  TDM0212  -  SC  -   S.D. ; - USD.;FUERO ORDINARIO;S.D.;S.D.;1;3;0;[];0;1;0;0;0;1;0;0;0;1;SI;NO;NO;PASIVO;S.D.;S.D.;S.D.;S.D.;S.D.;S.D.;S.D.;17;1701;170108;EXTERNO;PICHINCHA;QUITO;SUR - MENA;SUR - MENA;PILATAXI YUNGAN LUIS FABIAN;FISCALIA DE ACCIDENTES DE TRANSITO;1710572437;ASIMBAYA TACURI ELVIA SUSANA;FISCALIA DE ACCIDENTES DE TRANSITO 3;1,70102E+14;1,47193E+12;1,47167E+12;2016;2016;DAÑOS MATERIALES;NO FLAGRANTE;INVESTIGACION PREVIA;1,47201E+12;1,50355E+12;-2776;CONSUMADO;ARCHIVO ACEPTADO;1,47625E+12;ARCHIVADA POR ACEPTACION DE SOLICITUD;PARTE POLICIAL - TRANSITO - NO FLAGRANTE;AMT-2016-JQ-0613;CON ESTADO;3164;COIP;VIII - Infracciones de Tránsito;380;S.D.;1 ANIO;4 MESES;45 DIAS;45 DIAS;DAÑOS MATERIALES;Origen Desconocido;S.D.;S.D.;1,47193E+12;2016;8;9:22:48;16:30:00;TARDE;9:22:48;-0.290326,-78.565485;PICHINCHA;QUITO;"JOAQUIN DARQUEA Y NICOLAS CEVALLOS ; CALLE A Y SEGUNDO DARQUEA";CHILLOGALLO;URBANO;CHILLOGALLO;NO_APLICA;NO APLICA;NO APLICA;NO APLICA;Parque;MARTES;8;SABADO;8;AUTOMOTOR  -  TDM0212  -  SC  -   S.D.;#¿NOMBRE?;FUERO ORDINARIO;S.D.;S.D.;1;3;0;[];0;1;0;0;0;1;0;0;0;1;SI;NO;NO;PASIVO;S.D.;S.D.;S.D.;S.D.;S.D.;S.D.;S.D.;17;1701;170108;EXTERNO;S.D.;S.D.;S.D.;S.D.;S.D.;S.D.;S.D.;S.D.;S.D.;S.D.;S.D.;S.D.;S.D.;S.D.;S.D.;S.D.;S.D.;S.D.;S.D.;S.D.;S.D.;S.D.;S.D.;S.D.;S.D.;S.D.;S.D.;S.D.;S.D.;S.D.;S.D.;S.D.;S.D.;S.D.;S.D.;S.D.;S.D.;S.D.;S.D.;S.D.;S.D.;S.D.;S.D.;S.D.;S.D.;S.D.;S.D.;S.D.;S.D.;S.D.;S.D.;S.D.;S.D.;S.D.;S.D.;S.D.;S.D.;S.D.;S.D.;S.D.;S.D.;S.D.;S.D.;S.D.;S.D.;S.D.;S.D.;S.D.;S.D.;S.D.;S.D.;S.D.;S.D.;S.D.;S.D.;S.D.;S.D.;S.D.;S.D.;S.D.
PICHINCHA;QUITO;SUR - QUITUMBE;NORTE - AMAZONAS;SARANGO ROSADO MAYRA JULIANA;FISCALIA DE VIOLENCIA DE GENERO;1716156995;SIGCHA ORRICO MARIA ALEJANDRA ;FISCALIA DE VIOLENCIA DE GENERO 2;1,70102E+14;11/12/2019;08/12/2019;2019;2019;VIOLENCIA SEXUAL CONTRA LA MUJER O MIEMBROS DEL NÚCLEO FAMILIAR;NO FLAGRANTE;INVESTIGACION PREVIA;17/12/2019;16/12/2021;-1201;CONSUMADO;ARCHIVO ACEPTADO;16/08/2024 0:00;ARCHIVADA POR ACEPTACION DE SOLICITUD;INFORMES VINCULANTES;7833-2019-fge-udf-drr;CON ESTADO;3737;COIP;II - Delitos Contra los Derechos de Libertad;158;S.D.;1 ANIO,2 ANIO;4 MESES, 8 MESES;90 DIAS;45 DIAS;VIOLENCIA SEXUAL CONTRA LA MUJER O MIEMBROS DEL NÚCLEO FAMILIAR;Origen Desconocido;SOLICITUD DE ARCHIVO;27/03/2024;11/12/2019;2019;12;14:30:29;20:00:00;NOCHE;14:30:29;-0.24209,-78.52717;PICHINCHA;QUITO;"LA MAGDALENA  PARROQUIA LA MAGDALENA ; BARRIO JESUS DEL GRAN PODER";LA MAGDALENA;URBANO;SIN NOMBRE 26;NO_APLICA;NO APLICA;NO APLICA;NO APLICA;Oficina;MIERCOLES;12;DOMINGO;12; -   -   - ; - USD.;FUERO ORDINARIO;27/03/2024;SOLICITADO;5;6;0;[];0;1;0;0;0;1;1;0;0;1;NO;SI;NO;PASIVO;S.D.;S.D.;S.D.;S.D.;S.D.;S.D.;S.D.;17;1701;170121;EXTERNO;PICHINCHA;QUITO;SUR - QUITUMBE;NORTE - AMAZONAS;SARANGO ROSADO MAYRA JULIANA;FISCALIA DE VIOLENCIA DE GENERO;1716156995;SIGCHA ORRICO MARIA ALEJANDRA;FISCALIA DE VIOLENCIA DE GENERO 2;1,70102E+14;1,57604E+12;1,57578E+12;2019;2019;VIOLENCIA SEXUAL CONTRA LA MUJER O MIEMBROS DEL NÚCLEO FAMILIAR;NO FLAGRANTE;INVESTIGACION PREVIA;1,57656E+12;1,63963E+12;-1201;CONSUMADO;ARCHIVO ACEPTADO;1,72378E+12;ARCHIVADA POR ACEPTACION DE SOLICITUD;INFORMES VINCULANTES;7833-2019-fge-udf-drr;CON ESTADO;3737;COIP;II - Delitos Contra los Derechos de Libertad;158;S.D.;1 ANIO,2 ANIO;4 MESES, 8 MESES;90 DIAS;45 DIAS;VIOLENCIA SEXUAL CONTRA LA MUJER O MIEMBROS DEL NÚCLEO FAMILIAR;Origen Desconocido;SOLICITUD DE ARCHIVO;1,71152E+12;1,57604E+12;2019;12;14:30:29;20:00:00;NOCHE;14:30:29;-0.24209,-78.52717;PICHINCHA;QUITO;"LA MAGDALENA  PARROQUIA LA MAGDALENA ; BARRIO JESUS DEL GRAN PODER";LA MAGDALENA;URBANO;SIN NOMBRE 26;NO_APLICA;NO APLICA;NO APLICA;NO APLICA;Oficina;MIERCOLES;12;DOMINGO;12;-   -   -;#¿NOMBRE?;FUERO ORDINARIO;27/03/2024;SOLICITADO;5;6;0;[];0;1;0;0;0;1;1;0;0;1;NO;SI;NO;PASIVO;S.D.;S.D.;S.D.;S.D.;S.D.;S.D.;S.D.;17;1701;170121;EXTERNO;S.D.;S.D.;S.D.;S.D.;S.D.;S.D.;S.D.;S.D.;S.D.;S.D.;S.D.;S.D.;S.D.;S.D.;S.D.;S.D.;S.D.;S.D.;S.D.;S.D.;S.D.;S.D.;S.D.;S.D.;S.D.;S.D.;S.D.;S.D.;S.D.;S.D.;S.D.;S.D.;S.D.;S.D.;S.D.;S.D.;S.D.;S.D.;S.D.;S.D.;S.D.;S.D.;S.D.;S.D.;S.D.;S.D.;S.D.;S.D.;S.D.;S.D.;S.D.;S.D.;S.D.;S.D.;S.D.;S.D.;S.D.;S.D.;S.D.;S.D.;S.D.;S.D.;S.D.;S.D.;S.D.;S.D.;S.D.;S.D.;S.D.;S.D.;S.D.;S.D.;S.D.;S.D.;S.D.;S.D.;S.D.;S.D.;S.D.;S.D.
COTOPAXI;SIGCHOS;UNICA - SIGCHOS;UNICA - SIGCHOS;GRANJA PACHECO PAOLA ALEXANDRA;FISCALIA DE SOLUCIONES RAPIDAS;501488894;VALENZUELA MENDOZA SIMON ISAIAS ;FISCALIA DE SOLUCIONES RAPIDAS 1;5,07018E+13;11/03/2016;01/07/2013;2016;2013;ABUSO DE CONFIANZA;NO FLAGRANTE;INVESTIGACION PREVIA;14/03/2016;14/03/2017;-2939;CONSUMADO;ARCHIVO ACEPTADO;29/05/2017 0:00;ARCHIVADA POR ACEPTACION DE SOLICITUD;DENUNCIA FORMAL - ESCRITA;SN;CON ESTADO;3020;COIP;II - Delitos Contra los Derechos de Libertad;187;S.D.;1 ANIO;4 MESES;90 DIAS;45 DIAS;ABUSO DE CONFIANZA;Origen Desconocido;S.D.;S.D.;11/03/2016;2016;3;11:52:57;0:01:00;MADRUGADA;11:52:57;-0.82997,-78.98441;COTOPAXI;SIGCHOS;CHUGCHILLAN (P);CHUGCHILLAN;RURAL;CHUGCHILáN CENTRO;NO_APLICA;NO APLICA;NO APLICA;NO APLICA;S.D.;VIERNES;3;LUNES;7; -   -   - ; - USD.;FUERO ORDINARIO;24/05/2017;SOLICITADO;6;27;0;[];0;1;0;0;0;1;2;0;0;1;NO;NO;NO;PASIVO;S.D.;S.D.;S.D.;S.D.;S.D.;S.D.;S.D.;5;507;50751;EXTERNO;COTOPAXI;SIGCHOS;UNICA - SIGCHOS;UNICA - SIGCHOS;GRANJA PACHECO PAOLA ALEXANDRA;FISCALIA DE SOLUCIONES RAPIDAS;501488894;VALENZUELA MENDOZA SIMON ISAIAS;FISCALIA DE SOLUCIONES RAPIDAS 1;5,07018E+13;1,45767E+12;1,37265E+12;2016;2013;ABUSO DE CONFIANZA;NO FLAGRANTE;INVESTIGACION PREVIA;1,45793E+12;1,48947E+12;-2939;CONSUMADO;ARCHIVO ACEPTADO;1,49603E+12;ARCHIVADA POR ACEPTACION DE SOLICITUD;DENUNCIA FORMAL - ESCRITA;SN;CON ESTADO;3020;COIP;II - Delitos Contra los Derechos de Libertad;187;S.D.;1 ANIO;4 MESES;90 DIAS;45 DIAS;ABUSO DE CONFIANZA;Origen Desconocido;S.D.;S.D.;1,45767E+12;2016;3;11:52:57;0:01:00;MADRUGADA;11:52:57;-0.82997,-78.98441;COTOPAXI;SIGCHOS;CHUGCHILLAN (P);CHUGCHILLAN;RURAL;CHUGCHILáN CENTRO;NO_APLICA;NO APLICA;NO APLICA;NO APLICA;S.D.;VIERNES;3;LUNES;7;-   -   -;#¿NOMBRE?;FUERO ORDINARIO;24/05/2017;SOLICITADO;6;27;0;[];0;1;0;0;0;1;2;0;0;1;NO;NO;NO;PASIVO;S.D.;S.D.;S.D.;S.D.;S.D.;S.D.;S.D.;5;507;50751;EXTERNO;S.D.;S.D.;S.D.;S.D.;S.D.;S.D.;S.D.;S.D.;S.D.;S.D.;S.D.;S.D.;S.D.;S.D.;S.D.;S.D.;S.D.;S.D.;S.D.;S.D.;S.D.;S.D.;S.D.;S.D.;S.D.;S.D.;S.D.;S.D.;S.D.;S.D.;S.D.;S.D.;S.D.;S.D.;S.D.;S.D.;S.D.;S.D.;S.D.;S.D.;S.D.;S.D.;S.D.;S.D.;S.D.;S.D.;S.D.;S.D.;S.D.;S.D.;S.D.;S.D.;S.D.;S.D.;S.D.;S.D.;S.D.;S.D.;S.D.;S.D.;S.D.;S.D.;S.D.;S.D.;S.D.;S.D.;S.D.;S.D.;S.D.;S.D.;S.D.;S.D.;S.D.;S.D.;S.D.;S.D.;S.D.;S.D.;S.D.;S.D.
