PICHINCHA;QUITO;SUR - MENA;PJ - PICHINCHA;GAMBOA LAGUATAXI MARIA FERNANDA;FISCALIA DE PATRIMONIO CIUDADANO;1715967988;VARGAS ALMACHI MARIBEL YOLANDA ;FISCALIA DE PATRIMONIO CIUDADANO 2;1,70102E+14;28/08/2020;25/08/2020;2020;2020;ESTAFA;NO FLAGRANTE;INVESTIGACION PREVIA;09/11/2020;09/11/2022;-873;CONSUMADO;ARCHIVO ACEPTADO;01/08/2023 0:00;ARCHIVADA POR ACEPTACION DE SOLICITUD;DENUNCIA FORMAL - ORAL;SN;CON ESTADO;4071;COIP;II - Delitos Contra los Derechos de Libertad;186;S.D.;2 ANIO;8 MESES;90 DIAS;45 DIAS;ESTAFA;Origen Desconocido;SOLICITUD DE ARCHIVO;29/06/2023;28/08/2020;2020;8;20:56:06;19:30:00;NOCHE;20:56:06;-0.29588,-78.549;PICHINCHA;QUITO;"ADMINISTRACION ZONA QUITUMBE ; AV  RUMICHACA Y CONDOR ÑAN";QUITUMBE;URBANO;ALLPALLACTA;NO_APLICA;NO APLICA;NO APLICA;NO APLICA;S.D.;VIERNES;8;MARTES;8; -   -   - ; - USD.;FUERO ORDINARIO;29/06/2023;SOLICITADO;1;5;0;[];0;2;0;0;0;2;1;0;0;1;NO;NO;NO;PASIVO;S.D.;S.D.;S.D.;S.D.;S.D.;S.D.;S.D.;17;1701;170126;EXTERNO;PICHINCHA;QUITO;SUR - MENA;PJ - PICHINCHA;GAMBOA LAGUATAXI MARIA FERNANDA;FISCALIA DE PATRIMONIO CIUDADANO;1715967988;VARGAS ALMACHI MARIBEL YOLANDA;FISCALIA DE PATRIMONIO CIUDADANO 2;1,70102E+14;1,59859E+12;1,59833E+12;2020;2020;ESTAFA;NO FLAGRANTE;INVESTIGACION PREVIA;1,6049E+12;1,66797E+12;-873;CONSUMADO;ARCHIVO ACEPTADO;1,69087E+12;ARCHIVADA POR ACEPTACION DE SOLICITUD;DENUNCIA FORMAL - ORAL;SN;CON ESTADO;4071;COIP;II - Delitos Contra los Derechos de Libertad;186;S.D.;2 ANIO;8 MESES;90 DIAS;45 DIAS;ESTAFA;Origen Desconocido;SOLICITUD DE ARCHIVO;1,68801E+12;1,59859E+12;2020;8;20:56:06;19:30:00;NOCHE;20:56:06;-0.29588,-78.549;PICHINCHA;QUITO;"ADMINISTRACION ZONA QUITUMBE ; AV  RUMICHACA Y CONDOR ÑAN";QUITUMBE;URBANO;ALLPALLACTA;NO_APLICA;NO APLICA;NO APLICA;NO APLICA;S.D.;VIERNES;8;MARTES;8;-   -   -;#¿NOMBRE?;FUERO ORDINARIO;29/06/2023;SOLICITADO;1;5;0;[];0;2;0;0;0;2;1;0;0;1;NO;NO;NO;PASIVO;S.D.;S.D.;S.D.;S.D.;S.D.;S.D.;S.D.;17;1701;170126;EXTERNO;S.D.;S.D.;S.D.;S.D.;S.D.;S.D.;S.D.;S.D.;S.D.;S.D.;S.D.;S.D.;S.D.;S.D.;S.D.;S.D.;S.D.;S.D.;S.D.;S.D.;S.D.;S.D.;S.D.;S.D.;S.D.;S.D.;S.D.;S.D.;S.D.;S.D.;S.D.;S.D.;S.D.;S.D.;S.D.;S.D.;S.D.;S.D.;S.D.;S.D.;S.D.;S.D.;S.D.;S.D.;S.D.;S.D.;S.D.;S.D.;S.D.;S.D.;S.D.;S.D.;S.D.;S.D.;S.D.;S.D.;S.D.;S.D.;S.D.;S.D.;S.D.;S.D.;S.D.;S.D.;S.D.;S.D.;S.D.;S.D.;S.D.;S.D.;S.D.;S.D.;S.D.;S.D.;S.D.;S.D.;S.D.;S.D.;S.D.;S.D.
GUAYAS;GUAYAQUIL;EDIFICIO MONTECRISTI - GYE;EDIFICIO LA MERCED;TEJADA NOBOA  DIANA PRISCILA;FISCALIA DACE;1203202765;ARECHUA CAZA SEGUNDO RUBEN ;FISCALIA DACE 1;9,01018E+13;29/01/2016;28/01/2016;2016;2016;ROBO;NO FLAGRANTE;SIN ACCIONES;S.D.;S.D.;NO APLICA;CONSUMADO;SIN ESTADO;S.D.;ACTIVA;DENUNCIA FORMAL - ORAL;SN;SIN ESTADO;3595;COIP;II - Delitos Contra los Derechos de Libertad;189;S.D.;2 ANIO;8 MESES;90 DIAS;45 DIAS;ROBO;Origen Desconocido;S.D.;S.D.;29/01/2016;2016;1;14:25:36;14:50:00;TARDE;14:25:36;-2.21277112,-79.89791916;GUAYAS;GUAYAQUIL;CARLOS GUEVARA M CA 33B SO 4 NOVIEMBRE Y JOSE ANTEPARA AV 2 SO;GARCIA MORENO;URBANO;GARCIA MORENO;ROBO A PERSONAS;AREAS DE ACCESO PUBLICO;ASALTO;ARMA DE FUEGO;S.D.;VIERNES;1;JUEVES;1; -   -   - ;DINERO  - USD. 0.00;FUERO ORDINARIO;S.D.;S.D.;0;0;0;[];0;0;0;0;0;0;0;0;0;1;NO;NO;NO;ACTIVO;ROBO A PERSONAS;ROBO A PERSONAS;ROBO A PERSONAS;ROBO A PERSONAS;ROBO A PERSONAS;ROBO A PERSONAS;MODELO;9;901;90105;EXTERNO;GUAYAS;GUAYAQUIL;EDIFICIO MONTECRISTI - GYE;EDIFICIO LA MERCED;TEJADA NOBOA  DIANA PRISCILA;FISCALIA DACE;1203202765;ARECHUA CAZA SEGUNDO RUBEN;FISCALIA DACE 1;9,01018E+13;1,45404E+12;1,45396E+12;2016;2016;ROBO;NO FLAGRANTE;SIN ACCIONES;S.D.;S.D.;NO APLICA;CONSUMADO;SIN ESTADO;S.D.;ACTIVA;DENUNCIA FORMAL - ORAL;SN;SIN ESTADO;3595;COIP;II - Delitos Contra los Derechos de Libertad;189;S.D.;2 ANIO;8 MESES;90 DIAS;45 DIAS;ROBO;Origen Desconocido;S.D.;S.D.;1,45404E+12;2016;1;14:25:36;14:50:00;TARDE;14:25:36;-2.21277112,-79.89791916;GUAYAS;GUAYAQUIL;CARLOS GUEVARA M CA 33B SO 4 NOVIEMBRE Y JOSE ANTEPARA AV 2 SO;GARCIA MORENO;URBANO;GARCIA MORENO;ROBO A PERSONAS;AREAS DE ACCESO PUBLICO;ASALTO;ARMA DE FUEGO;S.D.;VIERNES;1;JUEVES;1;-   -   -;DINERO  - USD. 0.00;FUERO ORDINARIO;S.D.;S.D.;0;0;0;[];0;0;0;0;0;0;0;0;0;1;NO;NO;NO;ACTIVO;ROBO A PERSONAS;ROBO A PERSONAS;ROBO A PERSONAS;ROBO A PERSONAS;ROBO A PERSONAS;ROBO A PERSONAS;MODELO;9;901;90105;EXTERNO;S.D.;S.D.;S.D.;S.D.;S.D.;S.D.;S.D.;S.D.;S.D.;S.D.;S.D.;S.D.;S.D.;S.D.;S.D.;S.D.;S.D.;S.D.;S.D.;S.D.;S.D.;S.D.;S.D.;S.D.;S.D.;S.D.;S.D.;S.D.;S.D.;S.D.;S.D.;S.D.;S.D.;S.D.;S.D.;S.D.;S.D.;S.D.;S.D.;S.D.;S.D.;S.D.;S.D.;S.D.;S.D.;S.D.;S.D.;S.D.;S.D.;S.D.;S.D.;S.D.;S.D.;S.D.;S.D.;S.D.;S.D.;S.D.;S.D.;S.D.;S.D.;S.D.;S.D.;S.D.;S.D.;S.D.;S.D.;S.D.;S.D.;S.D.;S.D.;S.D.;S.D.;S.D.;S.D.;S.D.;S.D.;S.D.;S.D.;S.D.
MANABI;EL CARMEN;UNICA - EL CARMEN;UNICA - EL CARMEN;VELASQUEZ TRIVINO VIRGINIA BEATRIZ;FISCALIA DE VIOLENCIA DE GENERO;1308228038;ALCIVAR ZAMBRANO CECILIA LIZETH ;FISCALIA DE VIOLENCIA DE GENERO 2;1,30402E+14;11/10/2021;30/09/2021;2021;2021;VIOLENCIA PSICOLÓGICA CONTRA LA MUJER O MIEMBROS DEL NÚCLEO FAMILIAR;NO FLAGRANTE;INVESTIGACION PREVIA;13/10/2021;13/10/2022;-900;CONSUMADO;INVESTIGACION PREVIA;13/10/2021 0:00;ACTIVA;DENUNCIA FORMAL - ORAL;SN;CON ESTADO;3733;COIP;II - Delitos Contra los Derechos de Libertad;157;S.D.;1 ANIO;4 MESES;90 DIAS;45 DIAS;VIOLENCIA PSICOLÓGICA CONTRA LA MUJER O MIEMBROS DEL NÚCLEO FAMILIAR;Origen Desconocido;VALORACION PSICOLOGICA BARRE SALDARRIAGA SEGUNDO EMILIANO - CI/RUC: 1308701984;13/10/2021;11/10/2021;2021;10;16:19:12;16:19:12;TARDE;16:19:12;-0.27442,-79.45921;MANABI;EL CARMEN;"EL CARMEN ; BARRIO LA COLMENITA CARLOS ALBERTO ARAY";EL CARMEN;URBANO;BARRIO DESCONOCIDO;NO_APLICA;NO APLICA;NO APLICA;NO APLICA;Oficina;LUNES;10;JUEVES;9; -   -   - ; - USD.;FUERO ORDINARIO;S.D.;S.D.;1;3;0;[];0;2;0;0;0;2;2;0;0;1;NO;NO;NO;ACTIVO;S.D.;S.D.;S.D.;S.D.;S.D.;S.D.;S.D.;13;1304;130401;EXTERNO;MANABI;EL CARMEN;UNICA - EL CARMEN;UNICA - EL CARMEN;VELASQUEZ TRIVINO VIRGINIA BEATRIZ;FISCALIA DE VIOLENCIA DE GENERO;1308228038;ALCIVAR ZAMBRANO CECILIA LIZETH;FISCALIA DE VIOLENCIA DE GENERO 2;1,30402E+14;1,63393E+12;1,63298E+12;2021;2021;VIOLENCIA PSICOLÓGICA CONTRA LA MUJER O MIEMBROS DEL NÚCLEO FAMILIAR;NO FLAGRANTE;INVESTIGACION PREVIA;1,6341E+12;1,66564E+12;-900;CONSUMADO;INVESTIGACION PREVIA;1,6341E+12;ACTIVA;DENUNCIA FORMAL - ORAL;SN;CON ESTADO;3733;COIP;II - Delitos Contra los Derechos de Libertad;157;S.D.;1 ANIO;4 MESES;90 DIAS;45 DIAS;VIOLENCIA PSICOLÓGICA CONTRA LA MUJER O MIEMBROS DEL NÚCLEO FAMILIAR;Origen Desconocido;VALORACION PSICOLOGICA BARRE SALDARRIAGA SEGUNDO EMILIANO - CI/RUC: 1308701984;1,6341E+12;1,63393E+12;2021;10;16:19:12;16:19:12;TARDE;16:19:12;-0.27442,-79.45921;MANABI;EL CARMEN;"EL CARMEN ; BARRIO LA COLMENITA CARLOS ALBERTO ARAY";EL CARMEN;URBANO;BARRIO DESCONOCIDO;NO_APLICA;NO APLICA;NO APLICA;NO APLICA;Oficina;LUNES;10;JUEVES;9;-   -   -;#¿NOMBRE?;FUERO ORDINARIO;S.D.;S.D.;1;3;0;[];0;2;0;0;0;2;2;0;0;1;NO;NO;NO;ACTIVO;S.D.;S.D.;S.D.;S.D.;S.D.;S.D.;S.D.;13;1304;130401;EXTERNO;S.D.;S.D.;S.D.;S.D.;S.D.;S.D.;S.D.;S.D.;S.D.;S.D.;S.D.;S.D.;S.D.;S.D.;S.D.;S.D.;S.D.;S.D.;S.D.;S.D.;S.D.;S.D.;S.D.;S.D.;S.D.;S.D.;S.D.;S.D.;S.D.;S.D.;S.D.;S.D.;S.D.;S.D.;S.D.;S.D.;S.D.;S.D.;S.D.;S.D.;S.D.;S.D.;S.D.;S.D.;S.D.;S.D.;S.D.;S.D.;S.D.;S.D.;S.D.;S.D.;S.D.;S.D.;S.D.;S.D.;S.D.;S.D.;S.D.;S.D.;S.D.;S.D.;S.D.;S.D.;S.D.;S.D.;S.D.;S.D.;S.D.;S.D.;S.D.;S.D.;S.D.;S.D.;S.D.;S.D.;S.D.;S.D.;S.D.;S.D.
GUAYAS;GUAYAQUIL;EDIFICIO MONTECRISTI - GYE;UNIDAD JUDICIAL DE FLAGRANCIA – UVC CUARTEL MODELO;GUERRA TABARA MARIA DOLORES;FISCALIA DE PATRIMONIO CIUDADANO;918447947;PINEDA MAZA WILLIAM PATRICIO ;FISCALIA DE PATRIMONIO CIUDADANO 1;9,01018E+13;23/03/2021;20/03/2021;2021;2021;ESTAFA;NO FLAGRANTE;INVESTIGACION PREVIA;29/03/2021;29/03/2023;-733;CONSUMADO;INVESTIGACION PREVIA;29/03/2021 0:00;ACTIVA;DENUNCIA FORMAL - ORAL;SN;CON ESTADO;4071;COIP;II - Delitos Contra los Derechos de Libertad;186;S.D.;2 ANIO;8 MESES;90 DIAS;45 DIAS;ESTAFA;Origen Desconocido;ADJUNTO INFORMACION BANCO PICHINCHA;28/04/2021;23/03/2021;2021;3;13:00:35;14:34:00;TARDE;13:00:35;-2.21209,-79.88986;GUAYAS;GUAYAQUIL;"PARROQUIA XIMENA ; CDLA STA MONICA MZ 13 SOLAR 01";XIMENA;URBANO;XIMENA;NO_APLICA;NO APLICA;NO APLICA;NO APLICA;S.D.;MARTES;3;SABADO;3; -   -   - ;DINERO  - USD. 0.00;FUERO ORDINARIO;S.D.;S.D.;1;3;0;[];0;1;0;0;0;1;1;0;0;1;NO;NO;NO;ACTIVO;S.D.;S.D.;S.D.;S.D.;S.D.;S.D.;S.D.;9;901;90114;EXTERNO;GUAYAS;GUAYAQUIL;EDIFICIO MONTECRISTI - GYE;UNIDAD JUDICIAL DE FLAGRANCIA – UVC CUARTEL MODELO;GUERRA TABARA MARIA DOLORES;FISCALIA DE PATRIMONIO CIUDADANO;918447947;PINEDA MAZA WILLIAM PATRICIO;FISCALIA DE PATRIMONIO CIUDADANO 1;9,01018E+13;1,61648E+12;1,61622E+12;2021;2021;ESTAFA;NO FLAGRANTE;INVESTIGACION PREVIA;1,61699E+12;1,68007E+12;-733;CONSUMADO;INVESTIGACION PREVIA;1,61699E+12;ACTIVA;DENUNCIA FORMAL - ORAL;SN;CON ESTADO;4071;COIP;II - Delitos Contra los Derechos de Libertad;186;S.D.;2 ANIO;8 MESES;90 DIAS;45 DIAS;ESTAFA;Origen Desconocido;ADJUNTO INFORMACION BANCO PICHINCHA;1,61959E+12;1,61648E+12;2021;3;13:00:35;14:34:00;TARDE;13:00:35;-2.21209,-79.88986;GUAYAS;GUAYAQUIL;"PARROQUIA XIMENA ; CDLA STA MONICA MZ 13 SOLAR 01";XIMENA;URBANO;XIMENA;NO_APLICA;NO APLICA;NO APLICA;NO APLICA;S.D.;MARTES;3;SABADO;3;-   -   -;DINERO  - USD. 0.00;FUERO ORDINARIO;S.D.;S.D.;1;3;0;[];0;1;0;0;0;1;1;0;0;1;NO;NO;NO;ACTIVO;S.D.;S.D.;S.D.;S.D.;S.D.;S.D.;S.D.;9;901;90114;EXTERNO;S.D.;S.D.;S.D.;S.D.;S.D.;S.D.;S.D.;S.D.;S.D.;S.D.;S.D.;S.D.;S.D.;S.D.;S.D.;S.D.;S.D.;S.D.;S.D.;S.D.;S.D.;S.D.;S.D.;S.D.;S.D.;S.D.;S.D.;S.D.;S.D.;S.D.;S.D.;S.D.;S.D.;S.D.;S.D.;S.D.;S.D.;S.D.;S.D.;S.D.;S.D.;S.D.;S.D.;S.D.;S.D.;S.D.;S.D.;S.D.;S.D.;S.D.;S.D.;S.D.;S.D.;S.D.;S.D.;S.D.;S.D.;S.D.;S.D.;S.D.;S.D.;S.D.;S.D.;S.D.;S.D.;S.D.;S.D.;S.D.;S.D.;S.D.;S.D.;S.D.;S.D.;S.D.;S.D.;S.D.;S.D.;S.D.;S.D.;S.D.
SUCUMBIOS;LAGO AGRIO ( NUEVA LOJA );UNICA - NUEVA LOJA;UNICA - NUEVA LOJA;PAREDES NAVIA ANGEL ALFONSO;FISCALIA DE SOLUCIONES RAPIDAS;703882365;MOLINA ORDOÑEZ JAIRO XAVIER ;FISCALIA DE SOLUCIONES RAPIDAS 2;2,10102E+14;15/05/2024;14/05/2024;2024;2024;ROBO. SI EL ROBO SE PRODUCE ÚNICAMENTE CON FUERZA EN LAS COSAS.;NO FLAGRANTE;INVESTIGACION PREVIA;16/05/2024;16/05/2026;411;CONSUMADO;INVESTIGACION PREVIA;16/05/2024 0:00;ACTIVA;DENUNCIA FORMAL - ORAL;SN;CON ESTADO;4665;COIP;II - Delitos Contra los Derechos de Libertad;189;189 INC. 1;1 ANIO;8 MESES;90 DIAS;45 DIAS;ROBO;Origen Desconocido;DELEGACIÓN AL AGENTE INVESTIGADOR(22) ;16/05/2024;15/05/2024;2024;5;16:04:14;17:00:00;TARDE;16:04:14;-76.88583,-76.88583;SUCUMBIOS;LAGO AGRIO ( NUEVA LOJA );"LAGO AGRIO (NUEVA LOJA) ; KM  5 1 2 VIA A QUITO BARRIO EL CARMEN";NUEVA LOJA;URBANO;MIRADOR;ROBO DE MOTOS;AREAS DE ACCESO PUBLICO;ASALTO;DESCONOCE;Oficina;MIERCOLES;5;MARTES;5;MOTOCICLETA  -  jf577u  -  ROJO  -   ROBADO ; - USD.;FUERO ORDINARIO;S.D.;S.D.;1;2;0;[];0;1;0;0;0;1;1;0;0;1;NO;NO;NO;ACTIVO;ROBO DE MOTOS;ROBO DE MOTOS;S.D.;ROBO DE MOTOS;ROBO DE MOTOS;ROBO DE MOTOS;MODELO;21;2101;210161;EXTERNO;SUCUMBIOS;LAGO AGRIO ( NUEVA LOJA );UNICA - NUEVA LOJA;UNICA - NUEVA LOJA;PAREDES NAVIA ANGEL ALFONSO;FISCALIA DE SOLUCIONES RAPIDAS;703882365;MOLINA ORDOÑEZ JAIRO XAVIER;FISCALIA DE SOLUCIONES RAPIDAS 2;2,10102E+14;1,71575E+12;1,71566E+12;2024;2024;ROBO. SI EL ROBO SE PRODUCE ÚNICAMENTE CON FUERZA EN LAS COSAS.;NO FLAGRANTE;INVESTIGACION PREVIA;1,71584E+12;1,77891E+12;411;CONSUMADO;INVESTIGACION PREVIA;1,71584E+12;ACTIVA;DENUNCIA FORMAL - ORAL;SN;CON ESTADO;4665;COIP;II - Delitos Contra los Derechos de Libertad;189;189 INC. 1;1 ANIO;8 MESES;90 DIAS;45 DIAS;ROBO;Origen Desconocido;DELEGACIÓN AL AGENTE INVESTIGADOR(22);1,71584E+12;1,71575E+12;2024;5;16:04:14;17:00:00;TARDE;16:04:14;-76.88583,-76.88583;SUCUMBIOS;LAGO AGRIO ( NUEVA LOJA );"LAGO AGRIO (NUEVA LOJA) ; KM  5 1 2 VIA A QUITO BARRIO EL CARMEN";NUEVA LOJA;URBANO;MIRADOR;ROBO DE MOTOS;AREAS DE ACCESO PUBLICO;ASALTO;DESCONOCE;Oficina;MIERCOLES;5;MARTES;5;MOTOCICLETA  -  jf577u  -  ROJO  -   ROBADO;#¿NOMBRE?;FUERO ORDINARIO;S.D.;S.D.;1;2;0;[];0;1;0;0;0;1;1;0;0;1;NO;NO;NO;ACTIVO;ROBO DE MOTOS;ROBO DE MOTOS;S.D.;ROBO DE MOTOS;ROBO DE MOTOS;ROBO DE MOTOS;MODELO;21;2101;210161;EXTERNO;S.D.;S.D.;S.D.;S.D.;S.D.;S.D.;S.D.;S.D.;S.D.;S.D.;S.D.;S.D.;S.D.;S.D.;S.D.;S.D.;S.D.;S.D.;S.D.;S.D.;S.D.;S.D.;S.D.;S.D.;S.D.;S.D.;S.D.;S.D.;S.D.;S.D.;S.D.;S.D.;S.D.;S.D.;S.D.;S.D.;S.D.;S.D.;S.D.;S.D.;S.D.;S.D.;S.D.;S.D.;S.D.;S.D.;S.D.;S.D.;S.D.;S.D.;S.D.;S.D.;S.D.;S.D.;S.D.;S.D.;S.D.;S.D.;S.D.;S.D.;S.D.;S.D.;S.D.;S.D.;S.D.;S.D.;S.D.;S.D.;S.D.;S.D.;S.D.;S.D.;S.D.;S.D.;S.D.;S.D.;S.D.;S.D.;S.D.;S.D.
AZUAY;GUALACEO;UNICA - GUALACEO;UNICA - GUALACEO;RODRIGUEZ ORTIZ WASHINGTON XAVIER;FISCALIA DE VIOLENCIA DE GENERO;301567681;ROMO AMOROSO JOHANNA FERNANDA ;FISCALIA DE VIOLENCIA DE GENERO 2;1,03018E+13;21/02/2017;09/02/2017;2017;2017;VIOLENCIA PSICOLÓGICA CONTRA LA MUJER O MIEMBROS DEL NÚCLEO FAMILIAR;NO FLAGRANTE;INVESTIGACION PREVIA;21/02/2017;21/02/2018;-2595;CONSUMADO;ARCHIVO ACEPTADO;20/08/2021 0:00;ARCHIVADA POR ACEPTACION DE SOLICITUD;DENUNCIA FORMAL - ORAL;SN;CON ESTADO;3733;COIP;II - Delitos Contra los Derechos de Libertad;157;S.D.;1 ANIO;4 MESES;90 DIAS;45 DIAS;VIOLENCIA PSICOLÓGICA CONTRA LA MUJER O MIEMBROS DEL NÚCLEO FAMILIAR;Origen Desconocido;SOLICITUD DE ARCHIVO;21/03/2020;21/02/2017;2017;2;14:55:42;8:00:00;MAÑANA;14:55:42;-2.96471,-78.81597;AZUAY;GUALACEO;"SAN JUAN ; UZHAR";SAN JUAN;RURAL;SAN JUAN;NO_APLICA;NO APLICA;NO APLICA;NO APLICA;S.D.;MARTES;2;JUEVES;2; -   -   - ; - USD.;FUERO ORDINARIO;28/01/2022;RECHAZADO;2;4;0;[];0;1;0;0;0;1;1;0;0;1;NO;NO;NO;PASIVO;S.D.;S.D.;S.D.;S.D.;S.D.;S.D.;S.D.;1;103;10357;EXTERNO;AZUAY;GUALACEO;UNICA - GUALACEO;UNICA - GUALACEO;RODRIGUEZ ORTIZ WASHINGTON XAVIER;FISCALIA DE VIOLENCIA DE GENERO;301567681;ROMO AMOROSO JOHANNA FERNANDA;FISCALIA DE VIOLENCIA DE GENERO 2;1,03018E+13;1,48765E+12;1,48662E+12;2017;2017;VIOLENCIA PSICOLÓGICA CONTRA LA MUJER O MIEMBROS DEL NÚCLEO FAMILIAR;NO FLAGRANTE;INVESTIGACION PREVIA;1,48765E+12;1,51919E+12;-2595;CONSUMADO;ARCHIVO ACEPTADO;1,62944E+12;ARCHIVADA POR ACEPTACION DE SOLICITUD;DENUNCIA FORMAL - ORAL;SN;CON ESTADO;3733;COIP;II - Delitos Contra los Derechos de Libertad;157;S.D.;1 ANIO;4 MESES;90 DIAS;45 DIAS;VIOLENCIA PSICOLÓGICA CONTRA LA MUJER O MIEMBROS DEL NÚCLEO FAMILIAR;Origen Desconocido;SOLICITUD DE ARCHIVO;1,58477E+12;1,48765E+12;2017;2;14:55:42;8:00:00;MAÑANA;14:55:42;-2.96471,-78.81597;AZUAY;GUALACEO;"SAN JUAN ; UZHAR";SAN JUAN;RURAL;SAN JUAN;NO_APLICA;NO APLICA;NO APLICA;NO APLICA;S.D.;MARTES;2;JUEVES;2;-   -   -;#¿NOMBRE?;FUERO ORDINARIO;28/01/2022;RECHAZADO;2;4;0;[];0;1;0;0;0;1;1;0;0;1;NO;NO;NO;PASIVO;S.D.;S.D.;S.D.;S.D.;S.D.;S.D.;S.D.;1;103;10357;EXTERNO;S.D.;S.D.;S.D.;S.D.;S.D.;S.D.;S.D.;S.D.;S.D.;S.D.;S.D.;S.D.;S.D.;S.D.;S.D.;S.D.;S.D.;S.D.;S.D.;S.D.;S.D.;S.D.;S.D.;S.D.;S.D.;S.D.;S.D.;S.D.;S.D.;S.D.;S.D.;S.D.;S.D.;S.D.;S.D.;S.D.;S.D.;S.D.;S.D.;S.D.;S.D.;S.D.;S.D.;S.D.;S.D.;S.D.;S.D.;S.D.;S.D.;S.D.;S.D.;S.D.;S.D.;S.D.;S.D.;S.D.;S.D.;S.D.;S.D.;S.D.;S.D.;S.D.;S.D.;S.D.;S.D.;S.D.;S.D.;S.D.;S.D.;S.D.;S.D.;S.D.;S.D.;S.D.;S.D.;S.D.;S.D.;S.D.;S.D.;S.D.
AZUAY;CUENCA;PAUCARBAMBA;PAUCARBAMBA;CARDENAS RIVERA FABIAN MARCELO;FISCALIA DACE;301398558;MEDINA VILLARREAL KATERINE VICTORIA ;FISCALIA DACE 1;1,01018E+13;12/04/2022;28/03/2022;2022;2022;ROBO CUANDO EL ROBO SE PRODUCE ÚNICAMENTE CON FUERZA EN LAS COSAS;NO FLAGRANTE;INVESTIGACION PREVIA;13/04/2022;13/04/2023;-718;CONSUMADO;INVESTIGACION PREVIA;13/04/2022 0:00;ACTIVA;DENUNCIA FORMAL - ORAL;SN;CON ESTADO;3596;COIP;II - Delitos Contra los Derechos de Libertad;189;189 INC. 2;1 ANIO;4 MESES;90 DIAS;45 DIAS;ROBO;Origen Desconocido;DELEGACIÓN AL AGENTE INVESTIGADOR(22) ;13/04/2022;12/04/2022;2022;4;11:52:24;19:00:00;NOCHE;11:52:24;-2.9074968,-78.9832051;AZUAY;CUENCA;"AV 24 DE MAYO Y AV  MAX UHLE ; AV 24 DE MAYO ENTRE MAX UHLE Y AUTOPISTA";MONAY;URBANO;RUMI?AHUI;ROBO A DOMICILIO;VIVIENDA/ALOJAMIENTO;ESTRUCHE;DESCONOCE;Oficina;MARTES;4;LUNES;3; -   -   - ;TELEVISION  - USD. 200.00 700.00 800.00 400.00;FUERO ORDINARIO;S.D.;S.D.;1;1;0;[];0;0;0;0;0;0;1;0;0;1;NO;NO;NO;ACTIVO;ROBO A DOMICILIO;ROBO A DOMICILIO;ROBO A DOMICILIO;ROBO A DOMICILIO;ROBO A DOMICILIO;ROBO A DOMICILIO;MODELO;1;101;10109;EXTERNO;AZUAY;CUENCA;PAUCARBAMBA;PAUCARBAMBA;CARDENAS RIVERA FABIAN MARCELO;FISCALIA DACE;301398558;MEDINA VILLARREAL KATERINE VICTORIA;FISCALIA DACE 1;1,01018E+13;1,64974E+12;1,64844E+12;2022;2022;ROBO CUANDO EL ROBO SE PRODUCE ÚNICAMENTE CON FUERZA EN LAS COSAS;NO FLAGRANTE;INVESTIGACION PREVIA;1,64983E+12;1,68136E+12;-718;CONSUMADO;INVESTIGACION PREVIA;1,64983E+12;ACTIVA;DENUNCIA FORMAL - ORAL;SN;CON ESTADO;3596;COIP;II - Delitos Contra los Derechos de Libertad;189;189 INC. 2;1 ANIO;4 MESES;90 DIAS;45 DIAS;ROBO;Origen Desconocido;DELEGACIÓN AL AGENTE INVESTIGADOR(22);1,64983E+12;1,64974E+12;2022;4;11:52:24;19:00:00;NOCHE;11:52:24;-2.9074968,-78.9832051;AZUAY;CUENCA;"AV 24 DE MAYO Y AV  MAX UHLE ; AV 24 DE MAYO ENTRE MAX UHLE Y AUTOPISTA";MONAY;URBANO;RUMI?AHUI;ROBO A DOMICILIO;VIVIENDA/ALOJAMIENTO;ESTRUCHE;DESCONOCE;Oficina;MARTES;4;LUNES;3;-   -   -;TELEVISION  - USD. 200.00 700.00 800.00 400.00;FUERO ORDINARIO;S.D.;S.D.;1;1;0;[];0;0;0;0;0;0;1;0;0;1;NO;NO;NO;ACTIVO;ROBO A DOMICILIO;ROBO A DOMICILIO;ROBO A DOMICILIO;ROBO A DOMICILIO;ROBO A DOMICILIO;ROBO A DOMICILIO;MODELO;1;101;10109;EXTERNO;S.D.;S.D.;S.D.;S.D.;S.D.;S.D.;S.D.;S.D.;S.D.;S.D.;S.D.;S.D.;S.D.;S.D.;S.D.;S.D.;S.D.;S.D.;S.D.;S.D.;S.D.;S.D.;S.D.;S.D.;S.D.;S.D.;S.D.;S.D.;S.D.;S.D.;S.D.;S.D.;S.D.;S.D.;S.D.;S.D.;S.D.;S.D.;S.D.;S.D.;S.D.;S.D.;S.D.;S.D.;S.D.;S.D.;S.D.;S.D.;S.D.;S.D.;S.D.;S.D.;S.D.;S.D.;S.D.;S.D.;S.D.;S.D.;S.D.;S.D.;S.D.;S.D.;S.D.;S.D.;S.D.;S.D.;S.D.;S.D.;S.D.;S.D.;S.D.;S.D.;S.D.;S.D.;S.D.;S.D.;S.D.;S.D.;S.D.;S.D.
COTOPAXI;LATACUNGA;UNICA - LATACUNGA;UNICA - LATACUNGA;ALTAMIRANO GUERRA VERONICA CRISTINA;FISCALIA DE PATRIMONIO CIUDADANO;502104763;LOZADA LOPEZ LUIS ANIBAL ;FISCALIA DE PATRIMONIO CIUDADANO 3;5,01018E+13;27/04/2017;26/04/2017;2017;2017;ESTAFA;NO FLAGRANTE;INVESTIGACION PREVIA;02/05/2017;02/05/2019;-2160;CONSUMADO;ARCHIVO ACEPTADO;25/11/2019 0:00;ARCHIVADA POR ACEPTACION DE SOLICITUD;DENUNCIA FORMAL - ORAL;SN;CON ESTADO;3275;COIP;II - Delitos Contra los Derechos de Libertad;186;S.D.;2 ANIO;8 MESES;90 DIAS;45 DIAS;ESTAFA;Origen Desconocido;SOLICITUD DE ARCHIVO;08/11/2019;27/04/2017;2017;4;10:28:49;15:12:00;TARDE;10:28:49;-0.93361,-78.61452;COTOPAXI;LATACUNGA;"R  FITA Y F  SANCHEZ DE ORELLANA ; COOPERATIVA 29 DE OCTUBRE";LA MATRIZ;URBANO;CENTRO;NO_APLICA;NO APLICA;NO APLICA;NO APLICA;Calle;JUEVES;4;MIERCOLES;4; -   -   - ; - USD.;FUERO ORDINARIO;08/11/2019;SOLICITADO;2;7;0;[];0;1;0;0;0;1;1;0;0;1;NO;NO;NO;PASIVO;S.D.;S.D.;S.D.;S.D.;S.D.;S.D.;S.D.;5;501;50104;EXTERNO;COTOPAXI;LATACUNGA;UNICA - LATACUNGA;UNICA - LATACUNGA;ALTAMIRANO GUERRA VERONICA CRISTINA;FISCALIA DE PATRIMONIO CIUDADANO;502104763;LOZADA LOPEZ LUIS ANIBAL;FISCALIA DE PATRIMONIO CIUDADANO 3;5,01018E+13;1,49327E+12;1,49318E+12;2017;2017;ESTAFA;NO FLAGRANTE;INVESTIGACION PREVIA;1,4937E+12;1,55677E+12;-2160;CONSUMADO;ARCHIVO ACEPTADO;1,57466E+12;ARCHIVADA POR ACEPTACION DE SOLICITUD;DENUNCIA FORMAL - ORAL;SN;CON ESTADO;3275;COIP;II - Delitos Contra los Derechos de Libertad;186;S.D.;2 ANIO;8 MESES;90 DIAS;45 DIAS;ESTAFA;Origen Desconocido;SOLICITUD DE ARCHIVO;1,57319E+12;1,49327E+12;2017;4;10:28:49;15:12:00;TARDE;10:28:49;-0.93361,-78.61452;COTOPAXI;LATACUNGA;"R  FITA Y F  SANCHEZ DE ORELLANA ; COOPERATIVA 29 DE OCTUBRE";LA MATRIZ;URBANO;CENTRO;NO_APLICA;NO APLICA;NO APLICA;NO APLICA;Calle;JUEVES;4;MIERCOLES;4;-   -   -;#¿NOMBRE?;FUERO ORDINARIO;08/11/2019;SOLICITADO;2;7;0;[];0;1;0;0;0;1;1;0;0;1;NO;NO;NO;PASIVO;S.D.;S.D.;S.D.;S.D.;S.D.;S.D.;S.D.;5;501;50104;EXTERNO;S.D.;S.D.;S.D.;S.D.;S.D.;S.D.;S.D.;S.D.;S.D.;S.D.;S.D.;S.D.;S.D.;S.D.;S.D.;S.D.;S.D.;S.D.;S.D.;S.D.;S.D.;S.D.;S.D.;S.D.;S.D.;S.D.;S.D.;S.D.;S.D.;S.D.;S.D.;S.D.;S.D.;S.D.;S.D.;S.D.;S.D.;S.D.;S.D.;S.D.;S.D.;S.D.;S.D.;S.D.;S.D.;S.D.;S.D.;S.D.;S.D.;S.D.;S.D.;S.D.;S.D.;S.D.;S.D.;S.D.;S.D.;S.D.;S.D.;S.D.;S.D.;S.D.;S.D.;S.D.;S.D.;S.D.;S.D.;S.D.;S.D.;S.D.;S.D.;S.D.;S.D.;S.D.;S.D.;S.D.;S.D.;S.D.;S.D.;S.D.
GUAYAS;GUAYAQUIL;EDIFICIO MONTECRISTI - GYE;EDIFICIO LA MERCED;MORAN ARREAGA NINA EVELYN;FISCALIA DE SOLUCIONES RAPIDAS;909963886;LEON TENORIO VICTOR HUGO ;FISCALIA DE SOLUCIONES RAPIDAS 3;9,01018E+13;04/05/2016;03/05/2016;2016;2016;INTIMIDACIÓN;NO FLAGRANTE;INVESTIGACION PREVIA;11/05/2016;11/05/2017;-2881;CONSUMADO;ARCHIVO ACEPTADO;25/06/2019 0:00;ARCHIVADA POR ACEPTACION DE SOLICITUD;DENUNCIA FORMAL - ESCRITA;SN;CON ESTADO;3422;COIP;II - Delitos Contra los Derechos de Libertad;154;S.D.;1 ANIO;4 MESES;90 DIAS;45 DIAS;INTIMIDACIÓN;Origen Desconocido;SOLICITUD DE ARCHIVO;17/12/2018;04/05/2016;2016;5;9:18:21;13:30:00;TARDE;9:18:21;-2.14447,-79.89497;GUAYAS;GUAYAQUIL;"AGUSTIN FREIRE ICAZA CA 16 NE Y BAQUERIZO NAZUR AV 2 NE ; CDLA LA GARZOTA MZ  32 VILLA 30";TARQUI SUR;URBANO;TARQUI SUR;NO_APLICA;NO APLICA;NO APLICA;NO APLICA;Trabajo;MIERCOLES;5;MARTES;5; -   -   - ; - USD.;FUERO ORDINARIO;17/12/2018;SOLICITADO;1;1;0;[];0;1;0;0;0;1;1;0;0;1;NO;NO;NO;PASIVO;S.D.;S.D.;S.D.;S.D.;S.D.;S.D.;S.D.;9;901;90149;EXTERNO;GUAYAS;GUAYAQUIL;EDIFICIO MONTECRISTI - GYE;EDIFICIO LA MERCED;MORAN ARREAGA NINA EVELYN;FISCALIA DE SOLUCIONES RAPIDAS;909963886;LEON TENORIO VICTOR HUGO;FISCALIA DE SOLUCIONES RAPIDAS 3;9,01018E+13;1,46234E+12;1,46225E+12;2016;2016;INTIMIDACIÓN;NO FLAGRANTE;INVESTIGACION PREVIA;1,46294E+12;1,49448E+12;-2881;CONSUMADO;ARCHIVO ACEPTADO;1,56144E+12;ARCHIVADA POR ACEPTACION DE SOLICITUD;DENUNCIA FORMAL - ESCRITA;SN;CON ESTADO;3422;COIP;II - Delitos Contra los Derechos de Libertad;154;S.D.;1 ANIO;4 MESES;90 DIAS;45 DIAS;INTIMIDACIÓN;Origen Desconocido;SOLICITUD DE ARCHIVO;1,54502E+12;1,46234E+12;2016;5;9:18:21;13:30:00;TARDE;9:18:21;-2.14447,-79.89497;GUAYAS;GUAYAQUIL;"AGUSTIN FREIRE ICAZA CA 16 NE Y BAQUERIZO NAZUR AV 2 NE ; CDLA LA GARZOTA MZ  32 VILLA 30";TARQUI SUR;URBANO;TARQUI SUR;NO_APLICA;NO APLICA;NO APLICA;NO APLICA;Trabajo;MIERCOLES;5;MARTES;5;-   -   -;#¿NOMBRE?;FUERO ORDINARIO;17/12/2018;SOLICITADO;1;1;0;[];0;1;0;0;0;1;1;0;0;1;NO;NO;NO;PASIVO;S.D.;S.D.;S.D.;S.D.;S.D.;S.D.;S.D.;9;901;90149;EXTERNO;S.D.;S.D.;S.D.;S.D.;S.D.;S.D.;S.D.;S.D.;S.D.;S.D.;S.D.;S.D.;S.D.;S.D.;S.D.;S.D.;S.D.;S.D.;S.D.;S.D.;S.D.;S.D.;S.D.;S.D.;S.D.;S.D.;S.D.;S.D.;S.D.;S.D.;S.D.;S.D.;S.D.;S.D.;S.D.;S.D.;S.D.;S.D.;S.D.;S.D.;S.D.;S.D.;S.D.;S.D.;S.D.;S.D.;S.D.;S.D.;S.D.;S.D.;S.D.;S.D.;S.D.;S.D.;S.D.;S.D.;S.D.;S.D.;S.D.;S.D.;S.D.;S.D.;S.D.;S.D.;S.D.;S.D.;S.D.;S.D.;S.D.;S.D.;S.D.;S.D.;S.D.;S.D.;S.D.;S.D.;S.D.;S.D.;S.D.;S.D.
NAPO;TENA;UNICA - TENA;UNICA - TENA;IMUES TICMASA TERESA MATILDE;FISCALIA DE SOLUCIONES RAPIDAS;1500392988;ARIAS ESCOBAR ALEJANDRO RAFAEL ;FISCALIA DE SOLUCIONES RAPIDAS 3;1,50102E+14;19/03/2018;02/03/2018;2018;2018;ROBO CUANDO EL ROBO SE PRODUCE ÚNICAMENTE CON FUERZA EN LAS COSAS;NO FLAGRANTE;INVESTIGACION PREVIA;22/03/2018;22/03/2019;-2201;CONSUMADO;ARCHIVO ACEPTADO;27/02/2020 0:00;ARCHIVADA POR ACEPTACION DE SOLICITUD;DENUNCIA FORMAL - ESCRITA;SN;CON ESTADO;3596;COIP;II - Delitos Contra los Derechos de Libertad;189;189 INC. 2;1 ANIO;4 MESES;90 DIAS;45 DIAS;ROBO;Origen Desconocido;SOLICITUD DE ARCHIVO;19/11/2019;19/03/2018;2018;3;13:57:46;18:00:00;NOCHE;13:57:46;-0.97633,-77.81579;NAPO;TENA;"TENA ; BARRIO PLAN DE SALUD  CALLES BAÑOS Y SALINAS";TENA;URBANO;TENA;ROBO A DOMICILIO;VIVIENDA/ALOJAMIENTO;ESCALAMIENTO;DESCONOCE;Oficina;LUNES;3;VIERNES;3; -   -   - ;COMPUTADOR PORTATIL  - USD. 0.00;FUERO ORDINARIO;19/11/2019;SOLICITADO;3;10;0;[];0;1;0;0;0;1;2;0;0;1;NO;NO;NO;PASIVO;OTROS ROBOS;ROBO A DOMICILIO;ROBO A DOMICILIO;ROBO A DOMICILIO;OTROS ROBOS;ROBO A DOMICILIO;NUEVO;15;1501;150169;EXTERNO;NAPO;TENA;UNICA - TENA;UNICA - TENA;IMUES TICMASA TERESA MATILDE;FISCALIA DE SOLUCIONES RAPIDAS;1500392988;ARIAS ESCOBAR ALEJANDRO RAFAEL;FISCALIA DE SOLUCIONES RAPIDAS 3;1,50102E+14;1,52144E+12;1,51997E+12;2018;2018;ROBO CUANDO EL ROBO SE PRODUCE ÚNICAMENTE CON FUERZA EN LAS COSAS;NO FLAGRANTE;INVESTIGACION PREVIA;1,52169E+12;1,55323E+12;-2201;CONSUMADO;ARCHIVO ACEPTADO;1,58278E+12;ARCHIVADA POR ACEPTACION DE SOLICITUD;DENUNCIA FORMAL - ESCRITA;SN;CON ESTADO;3596;COIP;II - Delitos Contra los Derechos de Libertad;189;189 INC. 2;1 ANIO;4 MESES;90 DIAS;45 DIAS;ROBO;Origen Desconocido;SOLICITUD DE ARCHIVO;1,57414E+12;1,52144E+12;2018;3;13:57:46;18:00:00;NOCHE;13:57:46;-0.97633,-77.81579;NAPO;TENA;"TENA ; BARRIO PLAN DE SALUD  CALLES BAÑOS Y SALINAS";TENA;URBANO;TENA;ROBO A DOMICILIO;VIVIENDA/ALOJAMIENTO;ESCALAMIENTO;DESCONOCE;Oficina;LUNES;3;VIERNES;3;-   -   -;COMPUTADOR PORTATIL  - USD. 0.00;FUERO ORDINARIO;19/11/2019;SOLICITADO;3;10;0;[];0;1;0;0;0;1;2;0;0;1;NO;NO;NO;PASIVO;OTROS ROBOS;ROBO A DOMICILIO;ROBO A DOMICILIO;ROBO A DOMICILIO;OTROS ROBOS;ROBO A DOMICILIO;NUEVO;15;1501;150169;EXTERNO;S.D.;S.D.;S.D.;S.D.;S.D.;S.D.;S.D.;S.D.;S.D.;S.D.;S.D.;S.D.;S.D.;S.D.;S.D.;S.D.;S.D.;S.D.;S.D.;S.D.;S.D.;S.D.;S.D.;S.D.;S.D.;S.D.;S.D.;S.D.;S.D.;S.D.;S.D.;S.D.;S.D.;S.D.;S.D.;S.D.;S.D.;S.D.;S.D.;S.D.;S.D.;S.D.;S.D.;S.D.;S.D.;S.D.;S.D.;S.D.;S.D.;S.D.;S.D.;S.D.;S.D.;S.D.;S.D.;S.D.;S.D.;S.D.;S.D.;S.D.;S.D.;S.D.;S.D.;S.D.;S.D.;S.D.;S.D.;S.D.;S.D.;S.D.;S.D.;S.D.;S.D.;S.D.;S.D.;S.D.;S.D.;S.D.;S.D.;S.D.
